,url,cast,crew,Domestic Share:,Production Budget:,Legs:,Domestic Releases:,International Releases:,Video Release:,MPAA Rating:,Running Time:,Comparisons:,Keywords:,Source:,Genre:,Production Method:,Creative Type:,Production/Financing Companies:,Production Countries:,Languages:,Franchise:,Domestic Box Office,International Box Office,Worldwide Box Office,Est. Domestic Blu-ray Sales,Total Est. Domestic Video Sales
0,https://www.the-numbers.com/movie/Dr-Strangelove,"['Sterling Hayden', 'Keenan Wynn', 'Slim Pickens', 'Peter Sellers', 'George C. Scott']","[['Stanley Kubrick', 'Director'], ['Stanley Kubrick', 'Screenwriter'], ['Terry Southern', 'Screenwriter'], ['Peter George', 'Screenwriter'], ['Peter George', 'Story Creator'], ['Stanley Kubrick', 'Producer']]",99.2% (domestic box office/worldwide),"$1,800,000 (worldwide box office is 5.1 times production budget)",,"January 29th, 1964 (Wide) by Sony Pictures","May 17th, 2019 (Limited), released as Dr. Strangelove Or How I Learned To Stop Worrying And Love The Bomb (Re: 2019) & Stanley Kubrick Considers The Bomb (United Kingdom)
April 22nd, 2021 (Wide) (New Zealand)
","February 27th, 2001 by Sony Pictures Home Entertainment","PG 2004 Rating - for thematic elements, some violent content, sexual humor and mild language.",95 minutes,vs. I Care A LotCreate your own comparison chart…,"Same Actor, Multiple Roles, Black Comedy, Cold War, World War III, Novel or Other Work Adapted by Author, In a Plane, 1965 Oscars Best Picture Nominee",Based on Fiction Book/Short Story,Black Comedy,Live Action,Contemporary Fiction,Columbia Pictures,"United Kingdom, United States","English, Russian",,"$9,164,370","$74,491","$9,238,861",,
1,https://www.the-numbers.com/movie/Mans-Favorite-Sport,[],"[['Howard Hawks', 'Director']]",100.0% (domestic box office/worldwide),,,"January 29th, 1964 (Wide) by Universal",,,Not Rated Approved,120 minutes,Create your own comparison chart…,,,Romantic Comedy,Live Action,,,United States,English,,"$6,000,000",,,,
2,https://www.the-numbers.com/movie/Becket,[],"[['Peter Glenville', 'Director'], ['Edward Anhalt', 'Screenwriter']]",100.0% (domestic box office/worldwide),,654.64 (domestic box office/biggest weekend),"March 11th, 1964 (Wide) by Paramount Pictures",,"May 15th, 2007 by Mpi Home Video",PG-13 for some sexual content and violence,148 minutes,Create your own comparison chart…,"Biography, Biographical Drama, 1100s, Royalty, Religious, Death of a Best Friend, 1965 Oscars Best Picture Nominee",Based on Play,Drama,Live Action,Dramatization,,"United Kingdom, United States",English,,"$9,164,370",,,,
3,https://www.the-numbers.com/movie/Pink-Panther-The,"['Claudia Cardinale', 'Capucine*', 'David Niven', 'Peter Sellers', 'Robert Wagner']","[['Blake Edwards', 'Director'], ['Maurice Richlin', 'Screenwriter'], ['Blake Edwards', 'Screenwriter']]",100.0% (domestic box office/worldwide),,,"March 20th, 1964 (Wide) by MGM",,"June 27th, 2017 by Shout Factory, released as The Pink Panther Film Collection: Starring Peter Sellers",Not Rated,115 minutes,vs. A Shot in the DarkCreate your own comparison chart…,"Crime Comedy, Prologue, Royalty, Exile, Heist, Romance",Original Screenplay,Comedy,Live Action,Contemporary Fiction,,United Kingdom,"English, Italian",Pink Panther,"$10,878,107",,,"$1,631,262","$1,631,262"
4,https://www.the-numbers.com/movie/From-Russia-With-Love,['Sean Connery'],"[['Terence Young', 'Director'], ['Richard Maibaum', 'Screenwriter'], ['Albert R. Broccoli', 'Producer'], ['Ian Fleming', 'Story Creator']]",31.4% (domestic box office/worldwide),"$2,000,000 (worldwide box office is 39.5 times production budget)",,"April 8th, 1964 (Wide) by MGM","April 24th, 2009 (Wide), released as From Russia With Love (Re: 2009) (United Kingdom)
November 5th, 2020 (Wide) (Australia)
November 19th, 2020 (Limited) (New Zealand)
April 22nd, 2022 (Wide), released as From Russia With Love (Re: 2022) (United Kingdom)
December 9th, 2022 (Limited) (New Zealand)
... Show all releases
",,PG,115 minutes,vs. Dr. NoCreate your own comparison chart…,"Secret Agent, Character's Journey Shown on Map, Action Thriller, Cold War, Shadowy Organization",Based on Fiction Book/Short Story,Action,Live Action,Contemporary Fiction,"Eon Productions, United Artists",United Kingdom,English,James Bond,"$24,800,000","$54,100,000","$78,900,000",,
5,https://www.the-numbers.com/movie/Carpetbaggers-The,[],"[['Edward Dmytryk', 'Director'], ['John Michael Hayes', 'Screenwriter']]",100.0% (domestic box office/worldwide),,,"April 9th, 1964 (Wide) by Paramount Pictures",,,PG 1972 Rating - Re-Issue from 1963,150 minutes,vs. Mary PoppinsCreate your own comparison chart…,"Romantic Drama, Romance, Relationships Gone Wrong, Domestic Abuse, Posthumous Release, Prologue, Voiceover/Narration, Adult Child Dealing with the Death of a Parent, Death of a Twin, Death of a Sibling, Inheritance, Mental Illness, Dysfunctional Family, Addiction, Ensemble",Based on Fiction Book/Short Story,Drama,Live Action,Contemporary Fiction,,United States,English,,"$28,409,547",,,,
6,https://www.the-numbers.com/movie/What-a-Way-to-Go,[],[],100.0% (domestic box office/worldwide),,,"May 12th, 1964 (Wide)",,"January 11th, 2005 by Fox Home Entertainment",Not Rated Approved,111 minutes,Create your own comparison chart…,,,Romantic Comedy,Live Action,,,United States,"English, French",,"$11,180,531",,,,
7,https://www.the-numbers.com/movie/Viva-Las-Vegas,[],[],100.0% (domestic box office/worldwide),,,"May 20th, 1964 (Wide) by MGM",,,Not Rated Approved,85 minutes,vs. Blue HawaiiCreate your own comparison chart…,,,Musical,,,,United States,English,,"$9,442,967",,,,
8,https://www.the-numbers.com/movie/Shot-in-the-Dark-A,[],"[['Blake Edwards', 'Director'], ['Blake Edwards', 'Screenwriter'], ['William Peter Blatty', 'Screenwriter']]",100.0% (domestic box office/worldwide),,,"June 23rd, 1964 (Wide) by MGM",,"January 27th, 2009 by MGM Video",PG 1975 Rating - Re-Issue from 1964,102 minutes,vs. The Pink PantherCreate your own comparison chart…,"Crime Comedy, Relationships Gone Wrong, Infidelity, Romance, Framed, Blackmail, Surprise Twist",Based on Play,Comedy,Live Action,Contemporary Fiction,,"United Kingdom, United States","English, Spanish",Pink Panther,"$12,368,234",,,,
9,https://www.the-numbers.com/movie/Unsinkable-Molly-Brown-The,[],[],100.0% (domestic box office/worldwide),,,"July 11th, 1964 (Wide) by MGM",,"September 12th, 2011 by Warner Home Video",Not Rated Approved,128 minutes,vs. The Greatest Show on EarthCreate your own comparison chart…,,Based on Real Life Events,Musical,Live Action,Dramatization,,United States,English,,"$11,070,559",,,,
10,https://www.the-numbers.com/movie/Good-Neighbor-Sam,"['Jack Lemmon', 'Romy Schneider']","[['David Swift', 'Director']]",100.0% (domestic box office/worldwide),,,"July 22nd, 1964 (Wide) by Sony Pictures",,"September 15th, 1994 by Columbia Pictures Home Entertainment",Not Rated Approved,130 minutes,Create your own comparison chart…,Farcical / Slapstick Comedy,Based on Fiction Book/Short Story,Comedy,Live Action,Contemporary Fiction,,United States,English,,"$9,072,726",,,,
11,https://www.the-numbers.com/movie/Marnie,[],"[['Alfred Hitchcock', 'Director'], ['Jay Presson Allen', 'Screenwriter']]",99.9% (domestic box office/worldwide),,188.87 (domestic box office/biggest weekend),"July 22nd, 1964 (Wide)","June 29th, 2019 (Wide) (South Korea)
November 19th, 2020 (Wide) (New Zealand)
","March 1st, 1992 by Universal Home Entertainment",PG 1984 Rating - Re-Issue from 1964,130 minutes,vs. Torn CurtainCreate your own comparison chart…,"Psychological Thriller, White Collar Crime, False Identity, Blackmail, Unrequited Love, Sex Crimes, Prostitution, Dysfunctional Family, Relationships Gone Wrong, Killing in Self Defence",Based on Fiction Book/Short Story,Thriller/Suspense,Live Action,Contemporary Fiction,,United States,English,,"$7,000,000","$8,922","$7,008,922",,
12,https://www.the-numbers.com/movie/Mary-Poppins,"['David Tomlinson', 'Glynis Johns', 'Hermione Baddeley', 'Karen Dotrice', 'Matthew Garber', 'Elsa Lanchester', 'Arthur Treacher', 'Reginald Owen', 'Ed Wynn', 'Julie Andrews', 'Dick Van Dyke']","[['Robert Stevenson', 'Director'], ['Bill Walsh', 'Screenwriter'], ['Don DaGradi', 'Screenwriter'], ['P.L. Travers', 'Story based on the novel series by '], ['Cotton Warburton', 'Editor'], ['Richard M. Sherman', 'Composer'], ['Robert B. Sherman', 'Composer'], ['Edward Colman', 'Director of Photography']]",100.0% (domestic box office/worldwide),"$6,000,000 (worldwide box office is 17.0 times production budget)",,"August 26th, 1964 (Wide) by Walt DisneyMay 23rd, 1980 (Wide)","December 24th, 1975 (Wide) (South Korea)
April 13th, 2001 (Wide), released as Mary Poppins (re) (Australia)
February 3rd, 2014 (Wide) (New Zealand)
","March 25th, 1998 by Walt Disney Home Entertainment",G,139 minutes,vs. The Sound of MusicCreate your own comparison chart…,"Same Actor, Multiple Roles, Secret Magic, Breaking the Fourth Wall, Old Age Makeup, Dysfunctional Family, Fired, 1965 Oscars Best Picture Nominee",Based on Fiction Book/Short Story,Musical,Animation/Live Action,Kids Fiction,,United States,English,Mary Poppins,"$102,272,145","$24,325","$102,296,470",,
13,https://www.the-numbers.com/movie/Topkapi,[],[],100.0% (domestic box office/worldwide),,,"September 2nd, 1964 (Wide)",,,Not Rated Unrated,120 minutes,Create your own comparison chart…,,,,,,,United States,"English, French, German, Greek, Italian, Turkish",,"$7,000,000",,,,
14,https://www.the-numbers.com/movie/Send-Me-No-Flowers,[],"[['Norman Jewison', 'Director']]",100.0% (domestic box office/worldwide),,,"October 14th, 1964 (Wide) by Universal",,,Not Rated Approved,100 minutes,Create your own comparison chart…,,,,,,,United States,English,,"$9,129,247",,,,
15,https://www.the-numbers.com/movie/My-Fair-Lady-(1964),"['Gladys Cooper', 'Stanley Holloway', 'Wilfrid Hyde-White', 'Jeremy Brett', 'Theodore Bikel', 'Audrey Hepburn', 'Rex Harrison']","[['George Cukor', 'Director'], ['Alan Jay Lerner', 'Screenwriter'], ['Alan Jay Lerner', 'Story based on the play, book and lyrics by'], ['George Bernard Shaw', 'Story based on the play “Pygmalion” by'], ['Jack Warner', 'Producer'], ['Cecil Beaton', 'Production Designer'], ['William Ziegler', 'Editor'], ['Frederick Loewe', 'Composer'], ['Harry Stradling Sr.', 'Director of Photography']]",99.9% (domestic box office/worldwide),"$17,000,000 (worldwide box office is 4.2 times production budget)",,"October 22nd, 1964 (Wide)February 17th, 2019 (Special Engagement) by Fathom Events","July 22nd, 2016 (Wide), released as My Fair Lady: 50th Anniversary (Australia)
July 22nd, 2016 (Wide), released as My Fair Lady (50th Anniversary (New Zealand)
August 13th, 2022 (Special Engagement) (Portugal)
","October 6th, 2009 by Paramount Home Video",G (1970 re-issue),170 minutes,Best Picture Oscar Winnersvs. Oliver!Create your own comparison chart…,"Oscars Best Picture Winner, 1965 Oscars Best Picture Nominee",Based on Musical or Opera,Musical,Live Action,Historical Fiction,Warner Bros.,United States,English,,"$72,000,000","$72,607","$72,072,607","$3,129,921","$3,129,921"
16,https://www.the-numbers.com/movie/Father-Goose,[],[],100.0% (domestic box office/worldwide),,,"December 10th, 1964 (Wide) by Universal",,,Not Rated Approved,118 minutes,vs. Mary PoppinsCreate your own comparison chart…,,,Romantic Comedy,,,,United States,"English, French, Japanese",,"$12,500,000",,,,
17,https://www.the-numbers.com/movie/Zorba-the-Greek,[],"[['Michael Cacoyannis', 'Director']]",100.0% (domestic box office/worldwide),,,"December 16th, 1964 (Wide)",,,Not Rated,142 minutes,vs. Before MidnightCreate your own comparison chart…,1965 Oscars Best Picture Nominee,Based on Fiction Book/Short Story,Comedy,Live Action,Contemporary Fiction,,"Greece, United States","English, Greek",,"$9,000,000",,,,
18,https://www.the-numbers.com/movie/Goldfinger,"['Gert Fröbe', 'Honor Blackman', 'Sean Connery']","[['Guy Hamilton', 'Director'], ['Albert R. Broccoli', 'Producer']]",40.9% (domestic box office/worldwide),"$3,000,000 (worldwide box office is 41.6 times production budget)",,"December 22nd, 1964 (Wide) by MGM","February 26th, 1965 (Wide) (Australia)
July 27th, 2007 (Wide), released as Goldfinger (Re: 2007) (United Kingdom)
September 17th, 2020 (Wide) (New Zealand)
March 24th, 2022 (Wide), released as Goldfinger (Re: 2022) (United Kingdom)
","June 27th, 2006 by MGM Video",PG,110 minutes,vs. ThunderballCreate your own comparison chart…,"Visual Effects, Secret Agent",Based on Fiction Book/Short Story,Action,Live Action,Contemporary Fiction,"Eon Productions, United Artists",United Kingdom,English,James Bond,"$51,100,000","$73,800,000","$124,900,000",,
