,url,cast,crew,Domestic Share:,Infl. Adj. Dom. BO,Production Budget:,Opening Weekend:,Legs:,Theater counts:,Domestic Releases:,Video Release:,Running Time:,Franchise:,Comparisons:,Keywords:,Source:,Genre:,Production Method:,Creative Type:,Production/Financing Companies:,Production Countries:,Languages:,MPAA Rating:,International Releases:,Domestic Box Office,International Box Office,Worldwide Box Office,Est. Domestic Blu-ray Sales,Total Est. Domestic Video Sales
0,https://www.the-numbers.com/movie/Bad-News-Bears-Go-To-Japan-The,"['Tony Curtis', 'Jackie Earle Haley']","[['John Berry', 'Director'], ['Bill Lancaster', 'Screenwriter']]",100.0% (domestic box office/worldwide),"$54,863,239",,,,,1978 (Wide) by Paramount Pictures,"February 12th, 2002 by Paramount Home Video",91 minutes,Bad News Bears,Create your own comparison chart…,"Baseball, Sports Comedy, Set in Japan, Culture Clash, Bad Role Models, Sequels Without Their Original Stars, Underdog, Romance, Cross-Culture Romance",Original Screenplay,Comedy,Live Action,Contemporary Fiction,Paramount Pictures,United States,English,,,"$14,000,000",,,,
1,https://www.the-numbers.com/movie/Beyond-and-Back,[],[],100.0% (domestic box office/worldwide),"$93,267,520",,,,,1978 (Wide) by Sunn Classics Pictures,,,,Create your own comparison chart…,,Based on Fiction Book/Short Story,Documentary,Live Action,Factual,,United States,,,,"$23,800,000",,,,
2,https://www.the-numbers.com/movie/Big-Fix-The-(1978),['Richard Dreyfuss'],"[['Jeremy Paul Kagan', 'Director'], ['Roger L. Simon', 'Screenwriter'], ['Roger L. Simon', 'Story Creator']]",100.0% (domestic box office/worldwide),"$47,025,640",,,,,1978 (Wide) by Universal,,108 minutes,,Create your own comparison chart…,"Crime Comedy, Novel or Other Work Adapted by Author, Crime, Political, Political Campaign, Political Activist, Framed, Private Investigator",Based on Fiction Book/Short Story,Comedy,Live Action,Contemporary Fiction,,United States,,,,"$12,000,000",,,,
3,https://www.the-numbers.com/movie/Boys-from-Brazil-The,"['Gregory Peck', 'Laurence Olivier', 'James Mason']","[['Franklin J. Schaffner', 'Director'], ['Heywood Gould', 'Screenwriter'], ['Jerry Goldsmith', 'Composer']]",100.0% (domestic box office/worldwide),"$74,457,264","$12,000,000 (worldwide box office is 1.6 times production budget)",,,,1978 (Wide) by 20th Century Fox,"December 14th, 1999 by Lionsgate Home Entertainment, released as Boys From Brazil, The",125 minutes,,Create your own comparison chart…,"Cloning, Political Thriller, Nazis, Nazis Outside of World War II, Adopted Family, Young Child Dealing with the Death of a Parent, Dysfunctional Family",Based on Fiction Book/Short Story,Thriller/Suspense,Live Action,Contemporary Fiction,,"United Kingdom, United States",English,,,"$19,000,000",,,,
4,https://www.the-numbers.com/movie/Brinks-Job-The,[],"[['William Friedkin', 'Director'], ['Walon Green', 'Screenwriter']]",100.0% (domestic box office/worldwide),"$36,836,752",,,,,1978 (Wide) by Universal,"July 27th, 2011 by Universal Home Entertainment",104 minutes,,vs. Out ColdCreate your own comparison chart…,"Crime Comedy, Inspired by a True Story, Heist, Corporate Malfeasance, Set in Boston, Ensemble",Based on Factual Book/Article,Comedy,Live Action,Dramatization,,United States,,,,"$9,400,000",,,,
5,https://www.the-numbers.com/movie/Caseys-Shadow,[],"[['Martin Ritt', 'Director'], ['Carol Sobieski', 'Screenwriter']]",100.0% (domestic box office/worldwide),"$31,350,424",,,,,1978 (Wide) by Columbia,,117 minutes,,Create your own comparison chart…,"Miscellaneous Sports, Sports Drama, Father’s Footsteps, Animal Lead, Horse Racing, Death of a Pet, Professional Rivalry",Original Screenplay,Drama,Live Action,Contemporary Fiction,,United States,,,,"$8,000,000",,,,
6,https://www.the-numbers.com/movie/Coming-Home,"['Jane Fonda', 'Jon Voight', 'Bruce Dern']",[],100.0% (domestic box office/worldwide),"$127,960,683","$3,000,000 (worldwide box office is 10.9 times production budget)",,,,1978 (Wide) by United Artists,,119 minutes,,vs. PlatoonCreate your own comparison chart…,"Returning Soldiers, War, Vietnam War, IMAX: DMR, 1960s, PTSD, Relationships Gone Wrong, Infidelity, Suicide, Paralysis, Wheelchair User, Life Drama, 1979 Oscars Best Picture Nominee",Original Screenplay,Drama,Live Action,Historical Fiction,,United States,English,,,"$32,653,000",,,,
7,https://www.the-numbers.com/movie/Corvette-Summer,"['Mark Hamill', 'Annie Potts']",[],100.0% (domestic box office/worldwide),"$60,741,447",,,,,1978 (Wide) by MGM,"August 30th, 2005 by Warner Home Video",,,Create your own comparison chart…,,,,,,,United States,,,,"$15,500,000",,,,
8,https://www.the-numbers.com/movie/Fifth-Floor-The,[],[],100.0% (domestic box office/worldwide),"$27,431,615",,,,,1978 (Wide) by Film Ventures International,,,,Create your own comparison chart…,,,,,,,United States,,,,"$7,000,000",,,,
9,https://www.the-numbers.com/movie/Good-Guys-Wear-Black,[],"[['Ted Post', 'Director'], ['Bruce Cohn', 'Screenwriter'], ['Mark Medoff', 'Screenwriter']]",100.0% (domestic box office/worldwide),"$71,714,095",,,,,1978 (Wide) by American Cinema Releasing,,96 minutes,,vs. Dragon: The Bruce Lee StoryCreate your own comparison chart…,"Martial Arts, Action Thriller, 1970s, Vietnam War, POW, Rescue, C.I.A., Government Corruption",Original Screenplay,Action,Live Action,Contemporary Fiction,,United States,,,,"$18,300,000",,,,
10,https://www.the-numbers.com/movie/Greek-Tycoon-The,"['Raf Vallone', 'Eddie Albert', 'Charles Durning', 'Luciana Paluzzi', 'Camilla Sparv', 'Marilu Tolo', 'James Franciscus', 'Anthony Quinn', 'Jacqueline Bisset']","[['Jack Lee Thompson', 'Director'], ['Morton S. Fine', 'Screenwriter']]",100.0% (domestic box office/worldwide),"$54,863,239",,,,,1978 (Wide) by Universal,"August 6th, 1996 by Universal Home Entertainment, released as Greek Tycoon, The",107 minutes,,vs. Smokey and the BanditCreate your own comparison chart…,"Biographical Drama, Biography, Inspired by a True Story, Widow/Widower, Romance",Based on Real Life Events,Drama,Live Action,Dramatization,Universal Pictures,United States,English,,,"$14,000,000",,,,
11,https://www.the-numbers.com/movie/House-Calls,"['Walter Matthau', 'Glenda Jackson']","[['Howard Zieff', 'Director']]",100.0% (domestic box office/worldwide),"$113,645,296",,,,,1978 (Wide) by Universal,,,,vs. National Lampoon's Animal HouseCreate your own comparison chart…,,,,,,,United States,,,,"$29,000,000",,,,
12,https://www.the-numbers.com/movie/Ice-Castles,"['Robby Benson', 'Lynn-Holly Johnson']","[['Donald Wrye', 'Director'], ['Donald Wrye', 'Screenwriter'], ['Gary L. Baim', 'Screenwriter']]",100.0% (domestic box office/worldwide),"$70,538,455",,,,,1978 (Wide) by Columbia,"February 9th, 2010 by Sony Pictures Home Entertainment",110 minutes,,Create your own comparison chart…,"Romantic Drama, Romance, Figure Skating, Blindness, Remade",Original Screenplay,Drama,Live Action,Contemporary Fiction,,United States,,PG For some mild language,,"$18,000,000",,,,
13,https://www.the-numbers.com/movie/Other-Side-of-the-Mountain-Part-II-The,"['Marilyn Hassett', 'Timothy Bottoms']",[],100.0% (domestic box office/worldwide),"$47,025,640",,,,,1978 (Wide) by Universal,,,,Create your own comparison chart…,,,,,,,United States,,,,"$12,000,000",,,,
14,https://www.the-numbers.com/movie/Same-Time-Next-Year,"['Alan Alda', 'Ellen Burstyn']","[['Robert Mulligan', 'Director'], ['Walter Mirisch', 'Producer'], ['Morton Gottlieb', 'Producer'], ['Marvin Hamlisch', 'Composer']]",100.0% (domestic box office/worldwide),"$90,132,471",,,,,1978 (Wide) by Universal,"January 20th, 1993 by Universal Home Entertainment",119 minutes,,Create your own comparison chart…,,Based on Play,Romantic Comedy,Live Action,Contemporary Fiction,,United States,English,,,"$23,000,000",,,,
15,https://www.the-numbers.com/movie/Sgt-Peppers-Lonely-Hearts-Club-Band,"['Peter Frampton', 'Barry Gibb', 'Robin Gibb', 'Maurice Gibb']",[],100.0% (domestic box office/worldwide),"$50,552,559",,,,,1978 (Wide) by Universal,"August 12th, 2003 by Universal Home Entertainment",111 minutes,,vs. XanaduCreate your own comparison chart…,,,,,,,United States,,,,"$12,900,000",,,,
16,https://www.the-numbers.com/movie/Swarm-The,[],"[['Jerry Goldsmith', 'Composer']]",100.0% (domestic box office/worldwide),"$39,188,032",,,,,1978 (Wide) by Warner Bros.,"January 28th, 2016 by Warner Archive",,,vs. Hey Duggee At The Cinema - Autumn CollectionCreate your own comparison chart…,Animals Gone Bad,,,,,,United States,,,,"$10,000,000",,,,
17,https://www.the-numbers.com/movie/Thank-God-Its-Friday,[],[],100.0% (domestic box office/worldwide),"$28,607,264",,,,,1978 (Wide) by Columbia,"April 4th, 2006 by Sony Pictures Home Entertainment",,,Create your own comparison chart…,,,,,,,United States,,,,"$7,300,000",,,,
18,https://www.the-numbers.com/movie/Unmarried-Woman-An,['Jill Clayburgh'],"[['Paul Mazursky', 'Director'], ['Paul Mazursky', 'Screenwriter']]",100.0% (domestic box office/worldwide),"$94,051,280",,,,,1978 (Wide) by 20th Century Fox,"January 10th, 2006 by Fox Home Entertainment",124 minutes,,Create your own comparison chart…,"Romance, Comedy Drama, Relationships Gone Wrong, Divorcée Romance, Infidelity, 1979 Oscars Best Picture Nominee",Original Screenplay,Comedy,Live Action,Contemporary Fiction,,United States,English,,,"$24,000,000",,,,
19,https://www.the-numbers.com/movie/Betsy-The,"['Laurence Olivier', 'Robert Duvall', 'Katharine Ross', 'Tommy Lee Jones', 'Jane Alexander']","[['Daniel Petrie', 'Director'], ['William Bast', 'Screenwriter'], ['Walter Bernstein', 'Screenwriter'], ['Harold Robbins', 'Story Creator']]",100.0% (domestic box office/worldwide),"$69,362,815",,"$2,425,377 (13.7% of total gross)",7.30 (domestic box office/biggest weekend),"473 opening theaters/473 max. theaters, 1.0 weeks average run per theater","February 9th, 1978 (Wide) by Allied Artists",,125 minutes,,vs. Un homme et une femmeCreate your own comparison chart…,"Romantic Drama, 1920s, 1930s, Dysfunctional Family, Auto Racing, Relationships Gone Wrong, Infidelity",Based on Fiction Book/Short Story,Drama,Live Action,Historical Fiction,,United States,,,,"$17,700,000",,,,
20,https://www.the-numbers.com/movie/American-Hot-Wax-(1978),['Tim McIntire'],"[['Floyd Mutrux', 'Director'], ['John Kaye', 'Screenwriter']]",100.0% (domestic box office/worldwide),"$49,123,924",,,,,"March 17th, 1978 (Wide) by Paramount Pictures",,91 minutes,,Create your own comparison chart…,"Biographical Drama, Biography, 1950s, Radio Industry, Rock 'n' Roll, Censorship, Epilogue, Gratuitous Cameos",Original Screenplay,Drama,Live Action,Dramatization,,United States,,,,"$11,000,000",,,,
21,https://www.the-numbers.com/movie/F-I-S-T,['Sylvester Stallone'],"[['Norman Jewison', 'Director'], ['Joe Eszterhas', 'Screenwriter'], ['Sylvester Stallone', 'Screenwriter']]",100.0% (domestic box office/worldwide),"$79,900,163","$11,000,000 (worldwide box office is 1.9 times production budget)",,,,"April 13th, 1978 (Wide) by United Artists",,145 minutes,,vs. Rocky 2Create your own comparison chart…,"Crime Drama, Unions, Corporate Malfeasance, 1930s, Fired, 1940s, 1950s, Mafia, Screenplay Written By the Star",Based on Real Life Events,Drama,Live Action,Dramatization,,United States,,,,"$20,388,920",,,,
22,https://www.the-numbers.com/movie/End-The,"['Sally Field', 'Burt Reynolds', 'Dom DeLuise']","[['Burt Reynolds', 'Director'], ['Paul Williams', 'Composer']]",93.9% (domestic box office/worldwide),"$118,951,369",,,,,"May 5th, 1978 (Wide) by United Artists",,,,vs. Star Wars Ep. IV: A New HopeCreate your own comparison chart…,,,,,,,United States,,,,"$30,354,004","$1,980,473","$32,334,477",,
23,https://www.the-numbers.com/movie/Buddy-Holly-Story-The,[],"[['Steve Rash', 'Director'], ['Robert Gittler', 'Screenwriter']]",100.0% (domestic box office/worldwide),"$56,287,340",,,,,"May 18th, 1978 (Limited) by Columbia",,114 minutes,,vs. Lethal WeaponCreate your own comparison chart…,"Musicians, Biography, Biographical Drama, 1950s, Rock 'n' Roll, Posthumous Release",Based on Factual Book/Article,Drama,Live Action,Historical Fiction,,United States,,,,"$14,363,400",,,,
24,https://www.the-numbers.com/movie/Cheap-Detective-The,[],"[['Robert Moore', 'Director'], ['Neil Simon', 'Screenwriter']]",100.0% (domestic box office/worldwide),"$110,594,712",,,,,"June 9th, 1978 (Wide) by Columbia",,92 minutes,,Create your own comparison chart…,"Crime Comedy, Death of a Partner, Falsely Accused, Ensemble, Spoof, Set in San Francisco, Police Detective, Nazis, Nazi Treasure, Treasure Hunters, Femme Fatale",Original Screenplay,Comedy,Live Action,Historical Fiction,,United States,,,,"$28,221,552",,,,
25,https://www.the-numbers.com/movie/Damien-Omen-II,"['William Holden', 'Lee Grant', 'Jonathan Scott-Taylor']","[['Jerry Goldsmith', 'Composer']]",100.0% (domestic box office/worldwide),"$94,051,280",,"$3,880,880 (16.2% of total gross)",6.18 (domestic box office/biggest weekend),"525 opening theaters/525 max. theaters, 1.0 weeks average run per theater","June 9th, 1978 (Wide) by 20th Century Fox",,107 minutes,Omen,vs. The OmenCreate your own comparison chart…,"Supernatural Horror, Supernatural, Demons, Satanism, Occult",Original Screenplay,Horror,Live Action,Contemporary Fiction,,United States,,,,"$24,000,000",,,,
26,https://www.the-numbers.com/movie/Grease,"['Stockard Channing', 'John Travolta', 'Olivia Newton-John']","[['Randal Kleiser', 'Director']]",46.9% (domestic box office/worldwide),"$655,815,649","$6,000,000 (worldwide box office is 64.6 times production budget)","$8,941,717 (4.9% of total gross)",14.31 (domestic box office/biggest weekend),"862 opening theaters/2,931 max. theaters, 4.5 weeks average run per theater","June 16th, 1978 (Wide) by Paramount PicturesMarch 27th, 1998 (Wide) by Paramount PicturesJuly 8th, 2010 (Limited) by Paramount PicturesMay 14th, 2023 (Special Engagement) by Fathom Events (45th Anniversary)
","September 24th, 2002 by Paramount Home Video",110 minutes,Grease,vs. Mamma Mia!Create your own comparison chart…,"1950s, Gangs, High School, Cross-Culture Romance",Based on Musical or Opera,Musical,Live Action,Historical Fiction,,United States,English,PG,"June 16th, 1978 (Wide), released as Pomáda (Slovakia)
September 14th, 1978 (Wide) (United Kingdom)
July 16th, 1998 (Limited) (New Zealand)
December 15th, 2017 (Limited), released as Grease Sing-A-Long (re: 2014) (Spain)
June 15th, 2018 (Wide), released as Grease (40th aniversario) (1978) (re: 2018) (Spain)
... Show all releases
","$181,813,770","$205,658,547","$387,472,317",,
27,https://www.the-numbers.com/movie/Jaws-2,"['Roy Scheider', 'Lorraine Gary', 'Murray Hamilton']","[['Jeannot Szwarc', 'Director'], ['Carl Gottlieb', 'Screenwriter'], ['Howard Sackler', 'Screenwriter'], ['Richard D. Zanuck', 'Producer'], ['David Brown', 'Producer'], ['John Williams', 'Composer'], ['Joe Alves', 'Associate Producer'], ['Peter Benchley', 'Character Creator']]",49.3% (domestic box office/worldwide),"$403,332,556","$20,000,000 (worldwide box office is 10.4 times production budget)","$9,866,023 (9.6% of total gross)",10.43 (domestic box office/biggest weekend),"640 opening theaters/640 max. theaters, 1.0 weeks average run per theater","June 16th, 1978 (Wide) by Universal","May 22nd, 2001 by Universal Home Entertainment",116 minutes,Jaws,vs. Jaws 3-DCreate your own comparison chart…,"Animals Gone Bad, Visual Effects, Nature Horror",Based on Fiction Book/Short Story,Horror,Live Action,Contemporary Fiction,"Zancuk Company, David Brown, Universal Pictures",United States,English,PG,,"$102,922,376","$105,978,000","$208,900,376",,
28,https://www.the-numbers.com/movie/Convoy,"['Kris Kristofferson', 'Ali MacGraw']","[['Sam Peckinpah', 'Director']]",100.0% (domestic box office/worldwide),"$176,346,152",,,,,"June 28th, 1978 (Wide) by United Artists","April 28th, 2015 by Kino Lorber",110 minutes,,vs. Smokey and the BanditCreate your own comparison chart…,Road Trip,Based on Song,Action,Live Action,Contemporary Fiction,,United States,English,PG,,"$45,000,000",,,"$242,152","$242,152"
29,https://www.the-numbers.com/movie/Heaven-Can-Wait,"['Warren Beatty', 'Julie Christie']","[['Warren Beatty', 'Director']]",100.0% (domestic box office/worldwide),"$387,177,776","$15,000,000 (worldwide box office is 6.6 times production budget)","$3,652,486 (3.7% of total gross)",27.05 (domestic box office/biggest weekend),"540 opening theaters/540 max. theaters, 1.0 weeks average run per theater","June 28th, 1978 (Wide) by Paramount Pictures","July 27th, 1999 by Paramount Home Video",101 minutes,,vs. Jaws 2Create your own comparison chart…,"Football, Reincarnation, Heaven and Hell, 1979 Oscars Best Picture Nominee",Based on Play,Comedy,Live Action,Fantasy,,United States,English,PG,,"$98,800,000",,,,
30,https://www.the-numbers.com/movie/Foul-Play,"['Goldie Hawn', 'Chevy Chase']",[],100.0% (domestic box office/worldwide),"$158,379,141",,,,,"July 14th, 1978 (Wide) by Paramount Pictures",,,,vs. GreaseCreate your own comparison chart…,"Crime Comedy, Unbelieving Police, Dwarfism, Albino, Hitmen, Undercover, Romance, Catholic, Assassination, Pope, False Identity",Original Screenplay,Comedy,Live Action,Contemporary Fiction,,United States,,PG,,"$40,415,179",,,,
31,https://www.the-numbers.com/movie/Revenge-of-the-Pink-Panther,['Peter Sellers'],"[['Blake Edwards', 'Director']]",100.0% (domestic box office/worldwide),"$146,319,280",,,,,"July 21st, 1978 (Wide) by United Artists",,99 minutes,Pink Panther,vs. The Return of the Pink PantherCreate your own comparison chart…,"Crime Comedy, Police Detective, Organized Crime, Smuggler, Narcotics, Mafia, Hitmen, Assassination, Infidelity, Relationships Gone Wrong, The Other Woman, Faked Death",Original Screenplay,Comedy,Live Action,Contemporary Fiction,,United Kingdom,,,,"$37,337,746",,,,
32,https://www.the-numbers.com/movie/Hooper,"['Jan-Michael Vincent', 'Sally Field', 'Burt Reynolds']","[['Hal Needham', 'Director']]",100.0% (domestic box office/worldwide),"$200,997,523",,,,,"July 28th, 1978 (Wide) by Warner Bros.","April 7th, 2015 by Warner Home Video",,,vs. Jaws 2Create your own comparison chart…,,Original Screenplay,Action,Live Action,Contemporary Fiction,,United States,English,PG,,"$51,290,536",,,"$83,099","$83,099"
33,https://www.the-numbers.com/movie/National-Lampoons-Animal-House,"['John Belushi', 'Tim Matheson', 'John Vernon', 'Verna Bloom', 'Tom Hulce', 'Donald Sutherland']","[['John Landis', 'Director'], ['Douglas Kenney', 'Screenwriter'], ['Harold Ramis', 'Screenwriter'], ['Elmer Bernstein', 'Composer'], ['Stephen Bishop', 'Composer'], ['Matty Simmons', 'Producer'], ['Ivan Reitman', 'Producer']]",100.0% (domestic box office/worldwide),"$554,902,559","$3,000,000 (worldwide box office is 47.2 times production budget)",,,,"July 28th, 1978 (Wide) by Universal","August 26th, 2003 by Universal Home Entertainment",109 minutes,National Lampoon,vs. CaddyshackCreate your own comparison chart…,"College, Epilogue, Slobs vs. Snobs, Fraternity/Sorority, Breaking the Fourth Wall, Delayed Adulthood, Revenge, New Guy/Girl in School, Parties Gone Wild",Original Screenplay,Comedy,Live Action,Contemporary Fiction,Universal Pictures,United States,English,R,"June 8th, 2023 (Limited), released as Animal House (Italy)
","$141,600,000","$7,202","$141,607,202",,
34,https://www.the-numbers.com/movie/Eyes-of-Laura-Mars,"['Tommy Lee Jones', 'Brad Dourif', 'René Auberjonois', 'R.J.*', 'Faye Dunaway']","[['Irvin Kershner', 'Director'], ['John Carpenter', 'Screenwriter'], ['David Zelag Goodman', 'Screenwriter'], ['John Carpenter', 'Story by'], ['Jon Peters', 'Producer'], ['Jack H. Harris', 'Executive Producer'], ['Michael Kahn', 'Editor'], ['Artie Kane', 'Composer'], ['Laura Ziskin', 'Associate Editor']]",100.0% (domestic box office/worldwide),"$74,065,384",,,,,"August 2nd, 1978 (Wide) by Columbia","April 1st, 2014",104 minutes,,Create your own comparison chart…,"Crime Thriller, Psychics, Serial Killer, Police Detective, Police Shooting, Murder Mystery, Mental Illness, Multiple Personality, Film Noir, Photography, Models, Erotic Thriller",Original Screenplay,Thriller/Suspense,Live Action,Contemporary Fiction,"Columbia Pictures, Jon Peters",United States,English,,,"$18,900,000",,,,
35,https://www.the-numbers.com/movie/Interiors,"['Kristin Griffith', 'Mary Beth Hurt', 'Richard Jordan', 'Diane Keaton', 'E.G. Marshall', 'Geraldine Page', 'Maureen Stapleton', 'Sam Waterston']","[['Woody Allen', 'Director'], ['Woody Allen', 'Screenwriter']]",100.0% (domestic box office/worldwide),"$40,882,391",,,,,"August 2nd, 1978 (Wide) by United Artists",,92 minutes,,vs. Mamma Mia!Create your own comparison chart…,"Family Drama, Dysfunctional Family, Relationships Gone Wrong",Original Screenplay,Drama,Live Action,,,United States,,,,"$10,432,366",,,,
36,https://www.the-numbers.com/movie/Up-in-Smoke,"['Cheech Marin', 'Tommy Chong']","[['Tommy Chong', 'Director'], ['Waddy Wachtel', 'Composer']]",100.0% (domestic box office/worldwide),"$162,986,525",,,,,"September 15th, 1978 (Wide) by Paramount Pictures","April 10th, 2018 by Paramount Home Video",,Cheech & Chong,vs. This is the EndCreate your own comparison chart…,,,,,,,United States,,R (appeal upheld),,"$41,590,893",,,"$343,880","$343,880"
37,https://www.the-numbers.com/movie/Midnight-Express,['Brad Davis'],"[['Alan Parker', 'Director']]",100.0% (domestic box office/worldwide),"$137,158,111",,,,,"September 20th, 1978 (Wide) by Columbia",,121 minutes,,vs. National Lampoon's Animal HouseCreate your own comparison chart…,"Crime, Narcotics, Set in Turkey, Biographical Drama, Prison, Smuggler, Cruel Wardens or Prison Guards, Prison Break, 1970s, Based on an UNTRUE Story, Sex Crimes, Mental Hospital, 1979 Oscars Best Picture Nominee",Based on Fiction Book/Short Story,Drama,Live Action,Contemporary Fiction,,United Kingdom,,,"October 9th, 2020 (Wide) (New Zealand)
","$35,000,000",$134,"$35,000,134",,
38,https://www.the-numbers.com/movie/Death-on-the-Nile,"['Simon MacCorkindale', 'David Niven', 'Maggie Smith', 'Jack Warden', 'Peter Ustinov', 'Jane Birkin', 'Lois Chiles', 'Bette Davis', 'Mia Farrow', 'Jon Finch', 'Olivia Hussey', 'George Kennedy', 'Angela Lansbury']","[['John Guillermin', 'Director'], ['John Brabourne', 'Producer'], ['Richard Goodwin', 'Producer'], ['Anthony Shaffer', 'Screenwriter'], ['Nino Rota', 'Composer']]",100.0% (domestic box office/worldwide),"$70,538,455",,,,,"September 29th, 1978 (Wide) by Paramount Pictures","January 1st, 1998 by Artisan Entertainment",140 minutes,,vs. Death on the NileCreate your own comparison chart…,"Mystery Drama, Murder Mystery, Romance, Relationships Gone Wrong, Murder - Suicide, Inheritance, Surprise Twist, Blackmail, Gold Digger",Original Screenplay,Drama,Live Action,Historical Fiction,"Paramount Pictures, EMI Films, John Brabourne - Richard Goodwin Productions",United Kingdom,English,PG,"September 22nd, 2017 (Wide), released as Death On The Nile (re: 2017) (Australia)
April 14th, 2018 (Wide) (New Zealand)
February 11th, 2022 (Wide) (Mexico)
","$18,000,000","$7,517","$18,007,517",,
39,https://www.the-numbers.com/movie/Halloween-(1978),[],"[['John Carpenter', 'Director'], ['Tommy Lee Wallace', 'Editor']]",67.3% (domestic box office/worldwide),"$184,457,760","$325,000 (worldwide box office is 216.2 times production budget)",,172.53 (domestic box office/biggest weekend),,"October 17th, 1978 (Wide) by Compass InternationalOctober 30th, 2020 (Limited)","September 28th, 1999 by Anchor Bay Home Entertainment",91 minutes,Halloween,vs. Friday the 13thCreate your own comparison chart…,"Slasher Horror, Babysitters",Original Screenplay,Horror,Live Action,Contemporary Fiction,,United States,English,R,"October 10th, 2018 (Limited) (United Kingdom)
October 28th, 2021 (Limited) (New Zealand)
","$47,274,000","$23,000,000","$70,274,000",,
40,https://www.the-numbers.com/movie/Wiz-The,[],"[['Sidney Lumet', 'Director']]",100.0% (domestic box office/worldwide),"$86,213,672","$24,000,000 (worldwide box office is 0.9 times production budget)",,,,"October 24th, 1978 (Wide) by Universal","March 1st, 1992 by Universal Home Entertainment",134 minutes,,vs. I'm Gonna Git You SuckaCreate your own comparison chart…,African Americans,Remake,Musical,Live Action,Fantasy,,United States,English,,,"$22,000,000",,,,
41,https://www.the-numbers.com/movie/Magic,"['Ann-Margret', 'Burgess Meredith', 'Ed Lauter', 'Anthony Hopkins']","[['Richard Attenborough', 'Director'], ['Joseph E. Levine', 'Producer'], ['Richard Levine', 'Producer'], ['William Goldman', 'Screenwriter'], ['William Goldman', 'Story based upon the novel by'], ['Jerry Goldsmith', 'Composer'], ['C.O. Erickson', 'Executive Producer']]",100.0% (domestic box office/worldwide),"$93,267,520",,,,,"November 8th, 1978 (Wide) by 20th Century FoxFebruary 14th, 2020 (Limited) by MyCinema",,107 minutes,,vs. The Princess DiariesCreate your own comparison chart…,"Ventriloquism, Psychological Horror, Mental Illness, Romance, Infidelity, Relationships Gone Wrong, Serial Killer",Based on Fiction Book/Short Story,Horror,Live Action,Contemporary Fiction,,United States,English,R,,"$23,800,000",,,,
