113,https://www.the-numbers.com/movie/Hairspray-(2007),[],"[['Adam Shankman', 'Director'], ['Adam Shankman', 'Choreography'], ['Leslie Dixon', 'Screenwriter'], ['John Waters', 'Story Creator'], [""Mark O'Donnell"", 'Story Creator'], ['Thomas Meehan', 'Story Creator'], ['Marc Shaiman', 'Composer'], ['Scott Wittman', 'Song Writer'], ['Marc Shaiman', 'Song Writer'], ['Craig Zadan', 'Producer'], ['Neil Meron', 'Producer'], ['Bob Shaye', 'Executive Producer'], ['Michael Lynne', 'Executive Producer'], ['Toby Emmerich', 'Executive Producer'], ['Mark Kaufman', 'Executive Producer'], ['Marc Shaiman', 'Executive Producer'], ['Scott Wittman', 'Executive Producer'], ['Adam Shankman', 'Executive Producer'], ['Jennifer Gibgot', 'Executive Producer'], ['Garrett Grant', 'Executive Producer'], ['Michael Disco', 'Co-Producer'], ['Daryl Freimark', 'Co-Producer'], ['Travis Knox', 'Co-Producer'], ['Anson Downes', 'Associate Producer'], ['Linda Favila', 'Associate Producer']]","$27,476,745 (23.1% of total gross)",4.33 (domestic box office/biggest weekend),58.6% (domestic box office/worldwide),"$75,000,000 (worldwide box office is 2.7 times production budget)","3,121 opening theaters/3,121 max. theaters, 7.3 weeks average run per theater","$158,438,205","July 20th, 2007 (Wide) by New Line","November 19th, 2007 by Entertainment in VideoNovember 20th, 2007 by New Line Home Video","PG for language, some suggestive content and momentary teen smoking",115 minutes,vs. Les MisérablesCreate your own comparison chart…,"Dancing, TV Industry, Cross-Dressing, Fat Suit, Genderbending Casting, 1960s, Set in Baltimore, MD",Remake,Musical,Live Action,Historical Fiction,English,"New Line Cinema, Ingenious Film Partners, Zadan/Meron",United States,,"September 14th, 2007 (Wide) (Australia)
","$118,871,849","$104,949,580","$104,949,580","$83,951,012","$202,822,861",
114,https://www.the-numbers.com/movie/I-Now-Pronounce-You-Chuck-and-Larry,[],"[['Dennis Dugan', 'Director'], ['Barry Fanaro', 'Screenwriter'], ['Alexander Payne', 'Screenwriter'], ['Jim Taylor', 'Screenwriter'], ['Adam Sandler', 'Producer'], ['Jack Giarraputo', 'Producer'], ['Tom Shadyac', 'Producer'], ['Michael Bostick', 'Producer'], ['Barry Bernardi', 'Executive Producer'], ['Lew Gallo', 'Executive Producer'], ['Ryan Kavanaugh', 'Executive Producer'], ['Nick Swardson', 'Co-Producer'], ['Allen Covert', 'Co-Producer'], ['Kevin Grady', 'Co-Producer']]","$34,233,750 (28.6% of total gross)",3.50 (domestic box office/biggest weekend),64.5% (domestic box office/worldwide),"$85,000,000 (worldwide box office is 2.2 times production budget)","3,495 opening theaters/3,501 max. theaters, 5.9 weeks average run per theater","$159,575,698","July 20th, 2007 (Wide) by Universal","November 6th, 2007 by Universal Home Entertainment","PG-13 for crude sexual content throughout, nudity, language and drug references (Re-rated edited version)",115 minutes,vs. Big DaddyCreate your own comparison chart…,Buddy Comedy,Original Screenplay,Comedy,Live Action,Contemporary Fiction,English,"Universal Pictures, Relativity Media, Happy Madison",United States,,,"$119,725,280","$70,097,321","$70,097,321","$65,983,182","$185,708,462",
115,https://www.the-numbers.com/movie/Partner,[],[],"$584,245 (55.0% of total gross)",1.82 (domestic box office/biggest weekend),4.8% (domestic box office/worldwide),,"58 opening theaters/58 max. theaters, 2.0 weeks average run per theater","$1,416,600","July 20th, 2007 (Limited) by Eros Entertainment",,Not Rated,136 minutes,vs. KickCreate your own comparison chart…,"Foreign Language, Romance",Original Screenplay,Romantic Comedy,Live Action,Contemporary Fiction,Hindi,,India,,,"$1,062,840",,,"$20,853,261","$21,916,101",
116,https://www.the-numbers.com/movie/Hwa-ryeo-han-hyuga,[],"[['Kim Ji-hoon', 'Director']]",,,,,,,,,,125 minutes,Create your own comparison chart…,,Based on Real Life Events,Drama,Live Action,Dramatization,Korean,,Republic of Korea,,"July 25th, 2007 (Wide), released as May 18 (South Korea)
",n/a,,,"$49,136,551","$49,136,551",
117,https://www.the-numbers.com/movie/This-is-England,[],[],"$17,700 (5.4% of total gross)",9.80 (domestic box office/biggest weekend),3.8% (domestic box office/worldwide),"$2,380,000 (worldwide box office is 3.7 times production budget)","1 opening theaters/14 max. theaters, 9.1 weeks average run per theater","$437,061","July 25th, 2007 (Exclusive) by IFC Films",,Not Rated,,vs. Men go to BattleCreate your own comparison chart…,"Gangs, Neo Nazis",Original Screenplay,Drama,Live Action,Historical Fiction,,"FilmFour, UK Film Council, EM Media, Screen Yorkshire, Warp Films, Big Arty Productions",United Kingdom,,,"$327,919",,,"$8,411,657","$8,739,576",
118,https://www.the-numbers.com/movie/Simpsons-Movie-The,"['Julie Kavner', 'Nancy Cartwright', 'Yeardley Smith', 'Harry Shearer', 'Hank Azaria', 'Albert Brooks', 'Dan Castellaneta']","[['David Silverman', 'Director'], ['James L. Brooks', 'Producer'], ['Matt Groening', 'Producer'], ['Al Jean', 'Producer'], ['Mike Scully', 'Producer'], ['Richard Sakai', 'Producer'], ['Richard Raynis', 'Supervising Producer'], ['James L. Brooks', 'Screenwriter'], ['Matt Groening', 'Screenwriter'], ['Al Jean', 'Screenwriter'], ['Ian Maxstone-Graham', 'Screenwriter'], ['George Meyer', 'Screenwriter'], ['David Mirkin', 'Screenwriter'], ['Mike Reiss', 'Screenwriter'], ['Mike Scully', 'Screenwriter'], ['Matt Selman', 'Screenwriter'], ['John Swartzwelder', 'Screenwriter'], ['Jon Vitti', 'Screenwriter']]","$74,036,787 (40.4% of total gross)",2.47 (domestic box office/biggest weekend),34.7% (domestic box office/worldwide),"$72,500,000 (worldwide box office is 7.3 times production budget)","3,922 opening theaters/3,926 max. theaters, 6.0 weeks average run per theater","$244,091,287","July 27th, 2007 (Wide) by 20th Century Fox","December 18th, 2007 by Fox Home Entertainment, released as Simpsons Movie, The",PG-13 for irreverent humor throughout,86 minutes,vs. Shrek the ThirdCreate your own comparison chart…,"Dysfunctional Family, Disaster, End of the World, Fugitive / On the Run, Escape, Hitmen, Mafia",Based on TV,Adventure,Digital Animation,Contemporary Fiction,English,"Gracie Films, Matt Groening",United States,The Simpsons,"July 26th, 2007 (Wide) (Australia)
","$183,135,014","$97,407,459","$97,407,459","$343,936,008","$527,071,022",
119,https://www.the-numbers.com/movie/I-Know-Who-Killed-Me,[],"[['Chris Sivertson', 'Director'], ['Jeff Hammond', 'Screenwriter']]","$3,506,291 (48.5% of total gross)",2.06 (domestic box office/biggest weekend),100.0% (domestic box office/worldwide),,"1,320 opening theaters/1,320 max. theaters, 2.3 weeks average run per theater","$9,641,136","July 27th, 2007 (Wide) by Sony Pictures","November 27th, 2007 by Sony Pictures Home Entertainment","R for grisly violence including torture and disturbing gory images, and for sexuality, nudity and language",106 minutes,vs. The Love GuruCreate your own comparison chart…,"Kidnap, Serial Killer, Amputee, Psychological Thriller, Twins, Separated at Birth, Unbelieving Police, Rescue, Buried Alive, Famously Bad, Cult Movie",Original Screenplay,Thriller/Suspense,Live Action,Contemporary Fiction,English,,United States,,,"$7,233,485","$28,070,775","$28,070,775",,,
120,https://www.the-numbers.com/movie/No-Reservations,"['Abigail Breslin', 'Patricia Clarkson', 'Catherine Zeta-Jones', 'Aaron Eckhart']","[['Scott Hicks', 'Director'], ['Kerry Heysen', 'Producer'], ['Sergio Aguero', 'Producer'], ['Bruce Berman', 'Executive Producer'], ['Carol Fuchs', 'Screenwriter'], ['Susan Cartsonis', 'Executive Producer'], ['Stuart Dryburgh', 'Director of Photography'], ['Barbara Ling', 'Production Designer'], ['Pip Karmel', 'Editor'], ['Mari Jo Winkler-Ioffreda', 'Co-Producer'], ['Philip Glass', 'Composer']]","$11,704,357 (27.2% of total gross)",3.68 (domestic box office/biggest weekend),46.9% (domestic box office/worldwide),"$28,000,000 (worldwide box office is 3.3 times production budget)","2,425 opening theaters/2,425 max. theaters, 5.3 weeks average run per theater","$57,456,414","July 27th, 2007 (Wide) by Warner Bros.","February 12th, 2008 by Warner Home Video",PG for some sensuality and language,101 minutes,vs. Get SmartCreate your own comparison chart…,"Food, Unexpected Families, Romance",Remake,Romantic Comedy,Live Action,Contemporary Fiction,English,"Castle Rock Entertainment, Village Roadshow Productions",United States,,,"$43,107,979","$28,099,801","$28,099,801","$48,835,977","$91,943,956",
121,https://www.the-numbers.com/movie/Whos-Your-Caddy,[],"[['Don Michael Paul', 'Director'], ['Don Michael Paul', 'Screenwriter'], ['Bradley Allenstein', 'Screenwriter'], ['Robert Henny', 'Screenwriter'], ['Tracy E. Edmonds', 'Producer'], ['Christopher Eberts', 'Producer'], ['Arnold Rifkin', 'Producer'], ['Kia Jam', 'Producer'], ['Bob Weinstein', 'Executive Producer'], ['Harvey Weinstein', 'Executive Producer']]","$2,756,661 (48.4% of total gross)",2.07 (domestic box office/biggest weekend),100.0% (domestic box office/worldwide),"$7,000,000 (worldwide box office is 0.8 times production budget)","1,019 opening theaters/1,019 max. theaters, 2.6 weeks average run per theater","$7,589,651","July 27th, 2007 (Wide) by MGM","November 27th, 2007 by Weinstein Co./Genius","PG-13 for crude and sexual content, some nudity, language and drug material",93 minutes,vs. MallratsCreate your own comparison chart…,"Slobs vs. Snobs, Golf, African Americans, Sports Comedy, Famously Bad",Original Screenplay,Comedy,Live Action,Contemporary Fiction,English,,United States,,,"$5,694,308",,,,,
122,https://www.the-numbers.com/movie/Cantante-El,[],"[['Leon Ichaso', 'Director'], ['Leon Ichaso', 'Screenwriter'], ['David Darmstaedter', 'Screenwriter'], ['Todd Bello', 'Screenwriter']]","$3,202,035 (42.4% of total gross)",2.36 (domestic box office/biggest weekend),100.0% (domestic box office/worldwide),,"542 opening theaters/542 max. theaters, 3.5 weeks average run per theater","$10,071,008","August 1st, 2007 (Wide) by Picturehouse","October 30th, 2007 by New Line Home Video, released as Cantante, El","R for drug use, pervasive language and some sexuality.",114 minutes,vs. Hands of StoneCreate your own comparison chart…,"Biography, Biographical Drama, Singers, Music Industry, Prologue, 2000s, 1960s, Non-Chronological, Addiction, Narcotics",Based on Factual Book/Article,Drama,Live Action,Dramatization,"English, Spanish",,United States,,,"$7,556,004","$11,215,900","$11,215,900",,,
123,https://www.the-numbers.com/movie/Becoming-Jane,[],[],"$972,066 (5.2% of total gross)",6.36 (domestic box office/biggest weekend),47.4% (domestic box office/worldwide),"$16,500,000 (worldwide box office is 2.4 times production budget)","100 opening theaters/1,210 max. theaters, 5.6 weeks average run per theater","$24,876,165","August 3rd, 2007 (Limited) by MiramaxAugust 10th, 2007 (Expands Wide) by Miramax","February 12th, 2008 by Miramax Video",PG for brief nudity and mild language. (edited for re-rating; was PG-13),120 minutes,vs. The Big SickCreate your own comparison chart…,"Biography, Writing and Writers, Historical Drama, Romance, 1700s",Based on Real Life Events,Drama,Live Action,Dramatization,English,"Miramax Films, HanWay Films, UK Film Council, Bord Scannan na hEireann, Irish Film Board, 2 Entertain, BBC Films, Ecosse Films, Blueprint Films, Scion Films","Ireland, United Kingdom",,"October 11th, 2007 (Wide) (South Korea)
","$18,663,911","$8,399,160","$8,399,160","$20,716,920","$39,380,831",
124,https://www.the-numbers.com/movie/Bourne-Ultimatum-The,"['Julia Stiles', 'David Strathairn', 'Scott Glenn', 'Paddy Considine', 'Edgar Ramirez', 'Albert Finney', 'Joan Allen', 'Tom Gallop', 'Corey Johnson', 'Daniel Brühl', 'Joey Ansah', 'Colin Stinton', 'Matt Damon']","[['Paul Greengrass', 'Director'], ['Frank Marshall', 'Producer'], ['Patrick Crowley', 'Producer'], ['Paul L Sandberg', 'Producer'], ['Jeffrey M. Weiner', 'Executive Producer'], ['Henry Morrison', 'Executive Producer'], ['Doug Liman', 'Executive Producer'], ['Tony Gilroy', 'Screenwriter'], ['Scott Z. Burns', 'Screenwriter'], ['George Nolfi', 'Screenwriter'], ['Tony Gilroy', 'Story Creator'], ['Robert Ludlum', 'Screenwriter'], ['Oliver Wood', 'Cinematographer'], ['Peter Wenham', 'Production Designer'], ['Christopher Rouse', 'Editor'], ['John Powell', 'Composer']]","$69,283,690 (30.5% of total gross)",3.28 (domestic box office/biggest weekend),51.2% (domestic box office/worldwide),"$130,000,000 (worldwide box office is 3.4 times production budget)","3,660 opening theaters/3,701 max. theaters, 8.2 weeks average run per theater","$303,184,546","August 3rd, 2007 (Wide) by Universal","December 11th, 2007 by Universal Home Entertainment",PG-13 for violence and intense sequences of action,113 minutes,"Blockbusters, 2007vs. Jason BourneCreate your own comparison chart…","Secret Agent, Hitmen, Faulty Memory, Fugitive / On the Run",Based on Fiction Book/Short Story,Thriller/Suspense,Live Action,Contemporary Fiction,English,,United States,Bourne,"September 12th, 2007 (Wide) (South Korea)
","$227,471,070","$124,680,378","$127,275,730","$216,572,326","$444,043,396","$2,595,352"
125,https://www.the-numbers.com/movie/Bratz,[],"[['Sean McNamara', 'Director'], ['Susan Estelle Jansen', 'Screenwriter']]","$4,208,455 (42.0% of total gross)",2.38 (domestic box office/biggest weekend),38.4% (domestic box office/worldwide),,"1,509 opening theaters/1,509 max. theaters, 3.1 weeks average run per theater","$13,342,093","August 3rd, 2007 (Wide) by Lionsgate","November 27th, 2007 by Lionsgate Home Entertainment, released as Bratz - The Movie",PG for thematic elements,110 minutes,vs. Despicable Me 2Create your own comparison chart…,"New Guy/Girl in School, Toy Adaptations, Family Comedy, High School, High School Hell",Based on Toy,Comedy,Live Action,Kids Fiction,English,,United States,Bratz,,"$10,010,209","$39,853,779","$39,853,779","$16,075,206","$26,085,415",
126,https://www.the-numbers.com/movie/Cash-(2007),[],"[['Anubhav Sinha', 'Director']]",,,,,,,"August 3rd, 2007 (Limited) by AdLab Films",,,,Create your own comparison chart…,"Bollywood, Heist",Original Screenplay,Action,Live Action,Contemporary Fiction,"Hindi, Urdu",,,,,n/a,,,"$5,512,027","$5,512,027",
127,https://www.the-numbers.com/movie/Hot-Rod,[],"[['Akiva Schaffer', 'Director'], ['Pam Brady', 'Screenwriter'], ['Trevor Rabin', 'Composer']]","$5,310,711 (38.1% of total gross)",2.62 (domestic box office/biggest weekend),97.0% (domestic box office/worldwide),"$25,000,000 (worldwide box office is 0.6 times production budget)","2,607 opening theaters/2,607 max. theaters, 2.6 weeks average run per theater","$18,577,686","August 3rd, 2007 (Wide) by Paramount Pictures","November 27th, 2007 by Paramount Home Video","PG-13 for crude humor, language, some comic drug-related and violent content.",88 minutes,vs. Popstar: Never Stop Never StoppingCreate your own comparison chart…,"Daredevil, Dysfunctional Family, Sports Comedy, Medical and Hospitals, Money Troubles",Original Screenplay,Comedy,Live Action,Contemporary Fiction,English,,United States,,"November 26th, 2020 (Limited) (Australia)
","$13,938,332","$25,803,515","$25,803,515","$433,232","$14,371,564",
128,https://www.the-numbers.com/movie/Underdog,[],[],"$11,585,121 (26.5% of total gross)",3.78 (domestic box office/biggest weekend),67.3% (domestic box office/worldwide),,"3,013 opening theaters/3,013 max. theaters, 5.5 weeks average run per theater","$58,326,271","August 3rd, 2007 (Wide) by Walt Disney","December 18th, 2007 by Walt Disney Home Entertainment","PG for rude humor, mild language and action",82 minutes,vs. Underworld: AwakeningCreate your own comparison chart…,"Animal Lead, Live Action Cartoon, Talking Animals",Based on TV,Adventure,Animation/Live Action,Fantasy,English,,United States,,,"$43,760,605","$39,448,078","$39,448,078","$21,272,723","$65,033,328",
129,https://www.the-numbers.com/movie/Gekijo-ban-Kamen-Raida-Den-O-Ore-tanjo-(Japan)-(2007),[],"[['Takao Nagaishi', 'Director']]",,,,,,,,,,69 minutes,Create your own comparison chart…,,Based on TV,Action,,,Japanese,,Japan,Masked Rider,"August 4th, 2007 (Wide) (Japan)
",n/a,,,"$8,353,721","$8,353,721",
130,https://www.the-numbers.com/movie/Daddy-Day-Camp,"['Lochlyn Munro', 'Richard Gant', 'Tamala Jones', 'Paul Rae', 'Brian Doyle-Murray', 'Cuba Gooding, Jr.']","[['Fred Savage', 'Director'], ['J. David Stem', 'Screenwriter'], ['William Sherak', 'Producer'], ['Jason Shuman', 'Producer'], ['John Davis', 'Executive Producer'], ['Matt Berenson', 'Executive Producer'], ['Derek Dauchy', 'Executive Producer'], ['Richard Hull', 'Executive Producer'], ['Christopher Emerson', 'Executive Producer'], ['Nancy Kirhoffer', 'Executive Producer'], ['Jefferson Richard', 'Executive Producer']]","$3,402,678 (25.7% of total gross)",3.89 (domestic box office/biggest weekend),72.7% (domestic box office/worldwide),"$6,000,000 (worldwide box office is 3.0 times production budget)","2,332 opening theaters/2,814 max. theaters, 2.9 weeks average run per theater","$17,640,604","August 8th, 2007 (Wide) by Sony Pictures","January 29th, 2008 by Sony Pictures Home Entertainment",PG for mild bodily humor and language.,93 minutes,vs. DopeCreate your own comparison chart…,"Family Comedy, Summer Camp, Famously Bad, Sequels Without Their Original Stars, Sequel With Lead Character Recast, Actors Making Their Directorial Debut",Original Screenplay,Comedy,Live Action,Contemporary Fiction,English,"Davis Entertainment, Revolution Studios, Tri-Star Pictures, Blue Star Entertainment",United States,Daddy Day Care,,"$13,235,267","$5,766,743","$5,766,743","$4,974,605","$18,209,872",
131,https://www.the-numbers.com/movie/Chak-De-India,[],[],"$351,887 (31.6% of total gross)",3.16 (domestic box office/biggest weekend),7.4% (domestic box office/worldwide),,"62 opening theaters/62 max. theaters, 3.3 weeks average run per theater","$1,484,174","August 10th, 2007 (Limited) by Yash Raj Films",,Not Rated,148 minutes,vs. Rocket Singh: Salesman of the YearCreate your own comparison chart…,Miscellaneous Sports,Original Screenplay,Drama,Live Action,Contemporary Fiction,"English, Hindi",,India,,,"$1,113,541",,,"$13,845,785","$14,959,326",
132,https://www.the-numbers.com/movie/Deux-jours-a-Paris,[],"[['Julie Delpy', 'Director'], ['Julie Delpy', 'Screenwriter']]","$173,641 (3.9% of total gross)",7.15 (domestic box office/biggest weekend),30.5% (domestic box office/worldwide),,"10 opening theaters/148 max. theaters, 7.7 weeks average run per theater","$5,909,836","August 10th, 2007 (Exclusive) by Samuel Goldwyn Films, released as 2 Days in Paris","February 5th, 2008 by Fox Home Entertainment, released as Two Days in Paris","R for sexual content, some nudity and language.",96 minutes,Create your own comparison chart…,"Screenplay Written By the Star, Directing Yourself, Comedy Drama, Romance, Vacation, Relationships Gone Wrong",Original Screenplay,Comedy,Live Action,Contemporary Fiction,"English, French",,"France, Germany",2 Days In,,"$4,433,994",,,"$10,087,671","$14,521,665",
133,https://www.the-numbers.com/movie/Rush-Hour-3,[],"[['Brett Ratner', 'Director'], ['Jeff Nathanson', 'Screenwriter'], ['Jay Stern', 'Producer'], ['Jonathan Glickman', 'Producer'], ['Andrew Z. Davis', 'Producer'], ['Toby Emmerich', 'Executive Producer'], ['James M. Freitag', 'Co-Producer']]","$49,100,158 (35.0% of total gross)",2.85 (domestic box office/biggest weekend),54.6% (domestic box office/worldwide),"$180,000,000 (worldwide box office is 1.4 times production budget)","3,778 opening theaters/3,778 max. theaters, 6.2 weeks average run per theater","$186,766,729","August 10th, 2007 (Wide) by New Line","December 23rd, 2007 by New Line Home Video","PG-13 for sequences of action violence, sexual content, nudity and language",91 minutes,vs. Lethal Weapon 2Create your own comparison chart…,"Buddy Cop, Buddy Comedy, Martial Arts, Organized Crime",Original Screenplay,Action,Live Action,Contemporary Fiction,"Cantonese, English, French, Japanese","New Line Cinema, Arthur Sarkissian, Roger Birnbaum",United States,Rush Hour,,"$140,125,968","$41,580,212","$41,580,212","$116,459,914","$256,585,882",
134,https://www.the-numbers.com/movie/Skinwalkers,[],"[['Jim Isaac', 'Director'], ['Andrew Lockington', 'Composer']]","$753,520 (73.9% of total gross)",1.35 (domestic box office/biggest weekend),100.0% (domestic box office/worldwide),,"745 opening theaters/745 max. theaters, 1.5 weeks average run per theater","$1,358,123","August 10th, 2007 (Wide) by Lionsgate/After Dark","November 27th, 2007 by Lionsgate Home Entertainment","PG-13 for intense sequences of violence and action, some sexual material and language",110 minutes,vs. Black SheepCreate your own comparison chart…,Werewolf,Original Screenplay,Horror,Live Action,Fantasy,English,"Lionsgate, After Dark Films, Stan Winston Productions, Skinwalkers DCP Inc, Red Moon Films Inc",United States,,,"$1,018,965","$36,915,396","$36,915,396",,,
135,https://www.the-numbers.com/movie/Stardust,"['Ricky Gervais', 'Jason Flemyng', 'Rupert Everett', ""Peter O'Toole"", 'Claire Danes', 'Michelle Pfeiffer', 'Robert De Niro', 'Charlie Cox', 'Sienna Miller']","[['Matthew Vaughn', 'Director'], ['Matthew Vaughn', 'Screenwriter'], ['Jane Goldman', 'Screenwriter'], ['Charles Vess', 'Illustrator'], ['Neil Gaiman', 'Story Creator'], ['Matthew Vaughn', 'Producer'], ['Lorenzo di Bonaventura', 'Producer'], ['Michael Dreyer', 'Producer'], ['Neil Gaiman', 'Producer'], ['David Womark', 'Executive Producer'], ['Kris Thykier', 'Executive Producer'], ['Peter Morton', 'Executive Producer'], ['Stephen Marks', 'Executive Producer'], ['Ben Davis', 'Director of Photography'], ['Gavin Bocquet', 'Production Designer'], ['Jon Harris', 'Editor'], ['Peter Chiang', 'Visual Effects Supervisor'], ['Ilan Eshkeri', 'Composer']]","$9,169,779 (23.7% of total gross)",4.21 (domestic box office/biggest weekend),28.2% (domestic box office/worldwide),"$70,000,000 (worldwide box office is 2.0 times production budget)","2,540 opening theaters/2,565 max. theaters, 5.1 weeks average run per theater","$51,494,529","August 10th, 2007 (Wide) by Paramount Pictures","December 18th, 2007 by Paramount Home Video",PG-13 for some fantasy violence and risque humor,128 minutes,vs. Indiana Jones and the Last CrusadeCreate your own comparison chart…,"Royalty, Pirates, Visual Effects",Based on Fiction Book/Short Story,Adventure,Live Action,Fantasy,English,"Matthew Vaughn, Lorenzo di Bonaventura","United Kingdom, United States",,,"$38,634,938","$26,183,301","$26,183,301","$98,387,307","$137,022,245",
136,https://www.the-numbers.com/movie/Death-at-a-Funeral,[],"[['Frank Oz', 'Director'], ['Dean Craig', 'Screenwriter'], ['Sidney Kimmel', 'Producer'], ['Share Stallings', 'Producer'], ['Laurence Malkin', 'Producer'], ['Diana Phillips', 'Producer'], ['William Horberg', 'Executive Producer'], ['Bruce Toll', 'Executive Producer'], ['Andreas Grosch', 'Executive Producer'], ['Philip Elway', 'Executive Producer']]","$1,282,973 (15.0% of total gross)",6.69 (domestic box office/biggest weekend),18.1% (domestic box office/worldwide),"$20,000,000 (worldwide box office is 2.4 times production budget)","260 opening theaters/324 max. theaters, 8.0 weeks average run per theater","$11,436,411","August 17th, 2007 (Wide) by MGM","February 26th, 2008 by MGM Video",R for language and drug content,91 minutes,vs. Pitch PerfectCreate your own comparison chart…,"Funeral Reunions, LGBTQ+, Dysfunctional Family, Narcotics, Ensemble, Writing and Writers, In-Laws / Future In-Laws, White Collar Crime, Blackmail, Black Comedy, Remade",Original Screenplay,Black Comedy,Live Action,Contemporary Fiction,English,"Metro-Goldwyn-Mayer Pictures, Sidney Kimmel Entertainment, Parabolic Pictures, Stable Way Entertainment, VIP Medienfonds 1+2, Target Media",United Kingdom,,"October 12th, 2007 (Wide), released as Death At A Funeral (Australia)
","$8,580,428",,,"$38,708,720","$47,289,148",
