168,https://www.the-numbers.com/movie/Life-as-We-Know-It,"['Alexis Clagett', 'Brynn Clagett', 'Brooke Clagett', 'Josh Lucas', 'Christina Hendricks', 'Hayes MacArthur', 'Sarah Burns', 'Katherine Heigl', 'Josh Duhamel']","[['Barry Josephson', 'Producer'], ['Paul Brooks', 'Producer'], ['Denise Di Novi', 'Executive Producer'], ['Scott Niemeyer', 'Executive Producer'], ['Norm Waitt', 'Executive Producer'], ['Katherine Heigl', 'Executive Producer'], ['Nancy Heigl', 'Executive Producer'], ['Joe Hartwick Jr', 'Executive Producer'], ['Bruce Berman', 'Executive Producer'], ['Brad Kessell', 'Co-Producer'], ['Alexander Young', 'Co-Producer'], ['Greg Berlanti', 'Director'], ['Ian Deitchman', 'Screenwriter'], ['Kristian Rusk Robinson', 'Screenwriter']]","$14,506,464 (27.2% of total gross)",3.68 (domestic box office/biggest weekend),50.4% (domestic box office/worldwide),"$38,000,000 (worldwide box office is 2.8 times production budget)","3,150 opening theaters/3,150 max. theaters, 5.5 weeks average run per theater","$70,689,433",,vs. Bridget Jones’s BabyCreate your own comparison chart…,Romantic Comedy,United States,English,"October 8th, 2010 (Wide) by Warner Bros.","February 8th, 2011 by Warner Home Video, released as Life As We Know It","PG-13 for sexual material, language and some drug content(Rating bulletin 2125, 6/16/2010)",113 minutes,"Romance, Unexpected Families, Orphan, Dysfunctional Family, Romantic Comedy",Original Screenplay,Live Action,Contemporary Fiction,"Josephson Entertainment, Gold Circle Films, Village Roadshow Productions",,"$53,374,681","$52,513,156","$105,887,837","$20,480,693","$3,409,837","$23,890,530"
169,https://www.the-numbers.com/movie/My-Soul-to-Take,"['Max Thieriot', 'Denzel Whitaker', 'Raul Esparza', 'Shareeka Epps']","[['Wes Craven', 'Director'], ['Wes Craven', 'Screenwriter'], ['Wes Craven', 'Producer'], ['Iya Labunka', 'Producer'], ['Anthony Katagas', 'Producer'], ['Ryan Kavanaugh', 'Executive Producer'], ['Tucker Tooley', 'Executive Producer'], ['Andrew Rona', 'Executive Producer'], ['Petra Korner', 'Director of Photograpy'], ['Adam Stockhausen', 'Production Designer'], ['Peter McNulty', 'Editor'], ['Marco Beltrami', 'Composer'], ['Ed Gerrard', 'Music Supervisor'], ['Kurt and Bart', 'Costume Designer'], ['Avy Kaufman', 'Casting Director']]","$6,842,220 (46.4% of total gross)",2.15 (domestic box office/biggest weekend),88.1% (domestic box office/worldwide),"$25,000,000 (worldwide box office is 0.7 times production budget)","2,572 opening theaters/2,572 max. theaters, 2.9 weeks average run per theater","$19,528,438",,vs. Shark Night 3DCreate your own comparison chart…,Horror,United States,English,"October 8th, 2010 (Wide) by Universal","February 8th, 2011 by Universal Home Entertainment","R for strong bloody violence, and pervasive language including sexual references",107 minutes,"Slasher Horror, Mental Illness, Serial Killer, Reincarnation, Possessed, Surprise Twist, 3-D, 3-D - Post-production Conversion",Original Screenplay,Live Action,Contemporary Fiction,Rogue Pictures,,"$14,744,435","$1,983,035","$16,727,470","$5,270,737","$1,119,118","$6,389,855"
170,https://www.the-numbers.com/movie/Nowhere-Boy,"['Kristin Scott Thomas', 'Anne-Marie Duff', 'David Threlfall', 'David Morrissey', 'Thomas Brodie-Sangster', 'Josh Bolt', 'Ophelia Lovibond', 'James Johnson', 'Alex Ambrose', 'Angelica Jopling', 'Abby Greenhalgh', 'Aaron Johnson*']","[['Sam Taylor-Wood*', 'Director'], ['Matt Greenhalgh', 'Screenwriter'], ['Julia Baird', 'Screenwriter'], ['Douglas Rae', 'Producer'], ['Robert Bernstein', 'Producer'], ['Kevin Loader', 'Producer'], ['Jon Diamond', 'Executive Producer'], ['Christopher Moll', 'Executive Producer'], ['Tessa Ross', 'Executive Producer'], ['Matt Delargy', 'Co-Producer'], ['Paul Ritchie', 'Co-Producer'], ['Bob Weinstein', 'Co-Executive Producer'], ['Harvey Weinstein', 'Co-Executive Producer']]","$52,749 (3.6% of total gross)",4.24 (domestic box office/biggest weekend),18.6% (domestic box office/worldwide),"$1,900,000 (worldwide box office is 4.1 times production budget)","4 opening theaters/215 max. theaters, 4.6 weeks average run per theater","$1,914,325",,vs. ParklandCreate your own comparison chart…,Drama,"Canada, United Kingdom",English,"October 8th, 2010 (Limited) by Weinstein Co.",,"R for language and a scene of sexuality(Rating bulletin 2108, 2/17/2010)",97 minutes,"Coming of Age, Musicians, Biography, Epilogue",Based on Real Life Events,Live Action,Dramatization,"Film 4, UK Film Council, North West Vision, Lipsync Productions, Ecosse Films",,"$1,445,366","$6,339,863","$7,785,229",,,
171,https://www.the-numbers.com/movie/Secretariat,"['John Malkovich', 'Dylan Walsh', 'Dylan Baker', 'Margo Martindale', 'Nelsan Ellis', 'Otto Thorwarth', 'Diane Lane']","[['Gordon Gray', 'Producer'], ['Mark Ciardi', 'Producer'], ['Mark Ciardi', 'Executive Producer'], ['Mike Rich', 'Executive Producer'], ['Bill Johnson', 'Executive Producer'], ['Kim H. Winther', 'Co-Producer'], ['Randall Wallace', 'Director'], ['Mike Rich', 'Screenwriter'], ['William Nack', 'Story Creator'], ['Dean Semler', 'Director of Photography']]","$12,694,770 (21.3% of total gross)",4.70 (domestic box office/biggest weekend),98.9% (domestic box office/worldwide),"$35,000,000 (worldwide box office is 1.7 times production budget)","3,072 opening theaters/3,108 max. theaters, 6.6 weeks average run per theater","$79,065,369",,vs. RadioCreate your own comparison chart…,Drama,United States,English,"October 8th, 2010 (Wide) by Walt Disney","January 25th, 2011 by Walt Disney Home Entertainment","PG for brief mild language(Rating bulletin 2114 (Cert #46042), 3/31/2010)",123 minutes,"Miscellaneous Sports, Horse Racing, Inspirational Sports, Sports Drama",Based on Real Life Events,Live Action,Dramatization,"Walt Disney Pictures, Mayhem Pictures",,"$59,699,513","$676,734","$60,376,247","$40,073,626","$10,428,345","$50,501,971"
172,https://www.the-numbers.com/movie/Stone,"['Frances Conroy', 'Enver Gjokaj', 'Pepper Binkley', 'Robert De Niro', 'Edward Norton', 'Milla Jovovich']","[['Holly Wiersma', 'Producer'], ['Jordan Schur', 'Producer'], ['David Mimran', 'Producer'], ['Avi Lerner', 'Executive Producer'], ['Danny Dimbort', 'Executive Producer'], ['Trevor Short', 'Executive Producer'], ['Rene Besson', 'Executive Producer'], ['Ed Cathell III', 'Co-Producer'], ['Will French', 'Co-Executive Producer'], ['Stephen Roberts', 'Co-Executive Producer'], ['John Curran', 'Director'], ['Angus MacLachlan', 'Screenwriter']]","$75,766 (4.2% of total gross)",5.01 (domestic box office/biggest weekend),44.5% (domestic box office/worldwide),"$22,000,000 (worldwide box office is 0.2 times production budget)","6 opening theaters/125 max. theaters, 5.5 weeks average run per theater","$2,397,376","October 4th, 2012 (Wide) (Bolivia)
",vs. Gran TorinoCreate your own comparison chart…,Drama,United States,English,"October 8th, 2010 (Limited) by Overture Films","January 18th, 2011 by Anchor Bay Home Entertainment","R for strong sexuality and violence, and pervasive language.(Rating bulletin 2128, 7/7/2010)",105 minutes,Prison,Original Screenplay,Live Action,Contemporary Fiction,Mimran Schur Pictures,,"$1,810,078","$2,254,942","$4,065,020","$4,749,898","$1,189,560","$5,939,458"
173,https://www.the-numbers.com/movie/Tamara-Drewe,"['Jessica Barden', 'Charlotte Christie', 'Gemma Arterton', 'Roger Allam', 'Dominic Cooper', 'Luke Evans', 'Tamsin Greig']","[['Alison Owen', 'Producer'], ['Paul Trijbits', 'Producer'], ['Tracey Seaward', 'Producer'], ['Christine Langan', 'Executive Producer'], ['Sharon Harel', 'Executive Producer'], ['Maya Amsellem', 'Executive Producer'], ['Eve Schoukroun', 'Executive Producer'], ['Stephen Frears', 'Director'], ['Moira Buffini', 'Screenwriter'], ['Posy Simmonds', 'Story Creator']]","$18,604 (3.3% of total gross)",10.80 (domestic box office/biggest weekend),8.3% (domestic box office/worldwide),,"4 opening theaters/59 max. theaters, 5.9 weeks average run per theater","$741,981",,vs. Bridget Jones's DiaryCreate your own comparison chart…,Comedy,United Kingdom,English,"October 8th, 2010 (Limited) by Sony Pictures Classics",,"R for language and some sexuality.(Rating bulletin 2131, 7/28/2010)",110 minutes,"You Can't Go Home Again, Ugly Duckling, Relationships Gone Wrong, Romance",Based on Comic/Graphic Novel,Live Action,Contemporary Fiction,"WestEnd Films, BBC Films, UK Film Council, Ruby Films",,"$560,391","$6,167,359","$6,727,750",,,
174,https://www.the-numbers.com/movie/Conviction,"['Ari Graynor', 'Loren Dean', 'Conor Donovan', 'Owen Campbell', 'Juliette Lewis', 'Hilary Swank', 'Sam Rockwell', 'Minnie Driver', 'Julia Deakin', 'Melissa Leo', 'Peter Gallagher']","[['Andrew Sugerman', 'Producer'], ['Andrew S. Karsch', 'Producer'], ['Tony Goldwyn', 'Producer'], ['Hilary Swank', 'Executive Producer'], ['Markus Barmettler', 'Executive Producer'], ['Alwyn Hight Kushner', 'Executive Producer'], ['James Smith', 'Executive Producer'], ['Anthony Callie', 'Executive Producer'], ['Myles Nestel', 'Executive Producer'], ['Ed Cathell III', 'Co-Producer'], ['Dama Claire', 'Co-Producer'], ['Tony Goldwyn', 'Director'], ['Pamela Gray', 'Screenwriter']]","$102,351 (1.5% of total gross)",3.71 (domestic box office/biggest weekend),57.5% (domestic box office/worldwide),"$12,500,000 (worldwide box office is 0.9 times production budget)","11 opening theaters/672 max. theaters, 3.4 weeks average run per theater","$9,003,281","October 25th, 2012 (Wide) (Portugal)
",vs. LincolnCreate your own comparison chart…,Drama,United States,English,"October 15th, 2010 (Limited) by Fox Searchlight","February 1st, 2011 by Fox Home Entertainment",R for language and some violent images.,96 minutes,"Inspired by a True Story, Wrongfully Convicted, Courtroom Drama, Prison, Biography",Based on Real Life Events,Live Action,Dramatization,"Longfellow Pictures, Prescience, Oceana Media Finance",,"$6,797,696","$5,029,284","$11,826,980","$6,751,504","$583,005","$7,334,509"
175,https://www.the-numbers.com/movie/Hereafter,"['Jay Mohr', 'Bryce Dallas Howard', 'George McLaren', 'Frankie McLaren', 'Thierry Neuvic', 'Marthe Keller', 'Derek Jacobi', 'Matt Damon', 'Cécile de France']","[['Clint Eastwood', 'Director'], ['Peter Morgan', 'Screenwriter'], ['Clint Eastwood', 'Producer'], ['Kathleen Kennedy', 'Producer'], ['Robert Lorenz', 'Producer'], ['Steven Spielberg', 'Executive Producer'], ['Frank Marshall', 'Executive Producer'], ['Peter Morgan', 'Executive Producer'], ['Tim Moore', 'Executive Producer']]","$220,322 (0.7% of total gross)",2.72 (domestic box office/biggest weekend),30.1% (domestic box office/worldwide),"$50,000,000 (worldwide box office is 2.2 times production budget)","6 opening theaters/2,424 max. theaters, 4.1 weeks average run per theater","$43,371,826",,vs. SicarioCreate your own comparison chart…,Drama,United States,English,"October 15th, 2010 (Exclusive) by Warner Bros.October 22nd, 2010 (Expands Wide) by Warner Bros.","March 15th, 2011 by Warner Home Video","PG-13 for mature thematic elements including disturbing disaster and accident images, and for brief strong language.(Rating bulletin 2136, 9/1/2010)",129 minutes,"Twins, Disaster, Haunting, Psychics, Death of a Sibling, Death of a Twin, Addiction, Rehab / Former Addict, Terrorism, Fired, Afterlife, Near Death Experience, Life Drama, Ensemble",Original Screenplay,Live Action,Contemporary Fiction,"Malpaso Productions, The Kennedy/Marshall Company",,"$32,746,941","$75,913,329","$108,660,270","$7,936,291","$2,180,573","$10,116,864"
176,https://www.the-numbers.com/movie/Jackass-3D,[],"[['Jeff Tremaine', 'Director'], ['Preston Lacy', 'Screenwriter'], ['Harrison Stone', 'Screenwriter'], ['Jeff Tremaine', 'Producer'], ['Johnny Knoxville', 'Producer'], ['Spike Jonze', 'Producer'], ['Van Toffler', 'Executive Producer'], ['Derek Freda', 'Executive Producer'], ['Trip Taylor', 'Executive Producer']]","$50,353,641 (43.0% of total gross)",2.33 (domestic box office/biggest weekend),68.3% (domestic box office/worldwide),"$20,000,000 (worldwide box office is 8.6 times production budget)","3,081 opening theaters/3,139 max. theaters, 4.7 weeks average run per theater","$155,265,389",,vs. Jackass 3DCreate your own comparison chart…,Documentary,United States,English,"October 15th, 2010 (Wide) by Paramount Pictures","March 8th, 2011 by Paramount Home Video","R for male nudity, extremely crude and dangerous stunts throughout, and for language.(Rating bulletin 2140, 9/29/2010)",93 minutes,"Reality TV, Miscellaneous Sports, 3-D, 3-D - Shot in 3-D",Based on TV,Live Action,Factual,"MTV Films, Dickhouse",Jackass,"$117,229,692","$54,456,101","$171,685,793","$17,701,725","$4,599,956","$22,301,681"
177,https://www.the-numbers.com/movie/Red-(2010),"['Bruce Willis', 'Morgan Freeman', 'John Malkovich', 'Helen Mirren']","[['Lorenzo di Bonaventura', 'Producer'], ['Mark Vahradian', 'Producer'], ['Gregory Noveck', 'Executive Producer'], ['Jake Myers', 'Executive Producer'], ['David Ready', 'Co-Producer'], ['Robert Schwentke', 'Director'], ['Jon Hoeber', 'Screenwriter'], ['Erich Hoeber', 'Screenwriter'], ['Warren Ellis', 'Story Creator'], ['Cully Hamner', 'Story Creator']]","$21,761,408 (24.1% of total gross)",4.15 (domestic box office/biggest weekend),46.0% (domestic box office/worldwide),"$60,000,000 (worldwide box office is 3.3 times production budget)","3,255 opening theaters/3,349 max. theaters, 6.6 weeks average run per theater","$119,699,180",,vs. HannaCreate your own comparison chart…,Action,United States,English,"October 15th, 2010 (Wide) by Summit Entertainment","January 25th, 2011 by Summit Home Video","PG-13 for intense sequences of action violence and brief strong language.(Rating bulletin 2131, 7/28/2010)",110 minutes,"Secret Agent, Hitmen, D.C. Comics, Conspiracy Theory, Mental Illness",Based on Comic/Graphic Novel,Live Action,Contemporary Fiction,di Bonaventura Pictures,RED,"$90,380,162","$106,059,531","$196,439,693","$42,914,861","$18,050,843","$60,965,704"
178,https://www.the-numbers.com/movie/Paranormal-Activity-2-(2010),"['Brian Boland', 'Molly Ephraim', 'Sprague Grayden', 'Katie Featherston', 'Micah Sloat']","[['Jason Blum', 'Producer'], ['Oren Peli', 'Producer'], ['Steven Schneider', 'Executive Producer'], ['Akiva Goldsman', 'Executive Producer'], ['Amir Zbeda', 'Co-Producer'], ['Tod Williams', 'Director'], ['Michael R. Perry', 'Screenwriter'], ['Christopher Landon', 'Screenwriter'], ['Tom Pabst', 'Screenwriter'], ['Michael R. Perry', 'Story Creator'], ['Oren Peli', 'Story Creator']]","$40,678,424 (48.0% of total gross)",2.08 (domestic box office/biggest weekend),47.7% (domestic box office/worldwide),"$3,000,000 (worldwide box office is 59.2 times production budget)","3,216 opening theaters/3,239 max. theaters, 4.4 weeks average run per theater","$112,251,329",,vs. HannaCreate your own comparison chart…,Horror,United States,English,"October 20th, 2010 (IMAX) by Paramount PicturesOctober 22nd, 2010 (Wide) by Paramount Pictures","February 8th, 2011 by Paramount Home Video","R for some language and brief violent material.(Rating bulletin 2140, 9/29/2010)",91 minutes,"Found Footage, Demons, Prequel, Occult, IMAX: DMR, Supernatural, Supernatural Horror",Original Screenplay,Live Action,Contemporary Fiction,"Blumhouse, Solana Films",Paranormal Activity,"$84,752,907","$92,759,125","$177,512,032","$15,963,450","$4,394,062","$20,357,512"
179,https://www.the-numbers.com/movie/Boodanggeorae-(S-Korea),[],[],,,,,,,"October 28th, 2010 (Wide) (South Korea)
",Create your own comparison chart…,Drama,Republic of Korea,Korean,,,,119 minutes,Crime,Original Screenplay,Live Action,Contemporary Fiction,,,n/a,"$17,218,998","$17,218,998",,,
180,https://www.the-numbers.com/movie/Monsters,"['Scoot McNairy', 'Whitney Able']","[['Gareth Edwards', 'Director'], ['Allan Niblo', 'Producer'], ['James Richardson', 'Producer'], ['Nigel Williams', 'Executive Producer'], ['Nick Love', 'Executive Producer'], ['Rupert Preston', 'Executive Producer'], ['Gareth Edwards', 'Screenwriter']]","$20,508 (8.6% of total gross)",4.87 (domestic box office/biggest weekend),4.2% (domestic box office/worldwide),"$500,000 (worldwide box office is 11.3 times production budget)","3 opening theaters/25 max. theaters, 4.3 weeks average run per theater","$314,294",,vs. Another EarthCreate your own comparison chart…,Drama,United Kingdom,"English, Spanish","October 29th, 2010 (Limited) by Magnet Pictures","February 1st, 2011 by Magnolia Home Entertainment","R for language(Rating bulletin 2132, 8/4/2010)",97 minutes,"Alien Invasion, Non-Chronological, Road Trip, Set in Mexico, Photography, Investigative Journalist, On a Boat, Human-Trafficking, Scene Filmed in Night Vision, Romance, Quarantine",Original Screenplay,Live Action,Science Fiction,Vertigo Films,Monsters,"$237,301","$5,402,429","$5,639,730",,,
181,https://www.the-numbers.com/movie/Saw-3D-(2010),"['Costas Mandylor', 'Betsy Russell', 'Sean Patrick Flanery', 'Cary Elwes', 'Tobin Bell']","[['Gregg Hoffman', 'Producer'], ['Oren Koules', 'Producer'], ['Mark Burg', 'Producer'], ['Dan Heffner', 'Executive Producer'], ['Peter Block', 'Executive Producer'], ['Jason Constantine', 'Executive Producer'], ['James Wan', 'Executive Producer'], ['Leigh Whannell', 'Executive Producer'], ['Stacey Testro', 'Executive Producer'], ['Troy Begnaud', 'Co-Producer'], ['Kevin Greutert', 'Director'], ['Patrick Melton', 'Screenwriter'], ['Marcus Dunstan', 'Screenwriter']]","$24,230,123 (53.0% of total gross)",1.89 (domestic box office/biggest weekend),34.2% (domestic box office/worldwide),"$17,000,000 (worldwide box office is 7.9 times production budget)","2,808 opening theaters/2,808 max. theaters, 3.0 weeks average run per theater","$60,541,354","March 3rd, 2011 (Wide), released as Saw VII (New Zealand)
",vs. 1408Create your own comparison chart…,Horror,United States,English,"October 29th, 2010 (Wide) by Lionsgate","January 25th, 2011 by Lionsgate Home Entertainment","R for sequences of grisly bloody violence and torture, and language.(Rating bulletin 2127 (Cert #46227), 6/30/2010)",91 minutes,"Serial Killer, Torture Porn, Gratuitous Cameos, 3-D, 3-D - Shot in 3-D, Slasher Horror",Original Screenplay,Live Action,Contemporary Fiction,"Twisted Pictures, Burg-Knoules, Hoffman",Saw,"$45,710,178","$88,025,106","$133,735,284","$10,739,782","$4,406,563","$15,146,345"
182,https://www.the-numbers.com/movie/Wild-Target,"['Bill Nighy', 'Emily Blunt', 'Rupert Grint', 'Rupert Everett', 'Eileen Atkins', 'Gregor Fisher']","[['Martin Pope', 'Producer'], ['Michael Rose', 'Producer'], ['Steve Christian', 'Executive Producer'], ['Nigel Green', 'Executive Producer'], ['Philippe Martin', 'Executive Producer'], ['Marc Samuelson', 'Executive Producer'], ['Nigel Thomas', 'Executive Producer'], ['Charlotte Walls', 'Executive Producer'], ['Jonathan Lynn', 'Director'], ['Lucinda Coxon', 'Screenwriter']]","$23,174 (21.2% of total gross)",4.72 (domestic box office/biggest weekend),2.1% (domestic box office/worldwide),"$8,000,000 (worldwide box office is 0.7 times production budget)","4 opening theaters/13 max. theaters, 3.8 weeks average run per theater","$144,806",,vs. St. VincentCreate your own comparison chart…,Comedy,"France, United Kingdom",English,"October 29th, 2010 (Limited) by Freestyle Releasing","February 8th, 2011 by Fox Home Entertainment","PG-13 for violence, some sexual content and brief strong language(Rating bulletin 2125, 6/16/2010)",96 minutes,"Hitmen, Organized Crime, Confidence Men",Remake,Live Action,Contemporary Fiction,"Magic Light Pictures, Matador Pictures, Isle of Man Film, Cinema Four, Regent Capital",,"$109,338","$5,204,856","$5,314,194",,,
183,https://www.the-numbers.com/movie/127-Hours-(2010),"['Amber Tamblyn', 'Kate Mara', 'Clémence Poésy', 'Treat Williams', 'Kate Burton', 'Lizzy Caplan', 'James Franco']","[['Christian Colson', 'Producer'], ['Danny Boyle', 'Producer'], ['John Smithson', 'Producer'], ['Bernard Bellew', 'Executive Producer'], ['John L. Kelly', 'Executive Producer'], ['Francois Ivernel', 'Executive Producer'], ['Cameron McCracken', 'Executive Producer'], ['Lisa Maria Falcone', 'Executive Producer'], ['Tessa Ross', 'Executive Producer'], ['Tom Heller', 'Co-Producer'], ['Gareth Smith', 'Co-Producer'], ['Danny Boyle', 'Director'], ['Danny Boyle', 'Screenwriter'], ['Simon Beaufoy', 'Screenwriter'], ['Aron Ralston', 'Story Creator']]","$264,851 (1.4% of total gross)",8.58 (domestic box office/biggest weekend),30.4% (domestic box office/worldwide),"$18,000,000 (worldwide box office is 3.3 times production budget)","4 opening theaters/916 max. theaters, 5.4 weeks average run per theater","$24,231,523",,"Best Picture Oscar Nominees, 2011vs. BuriedCreate your own comparison chart…",Drama,United States,English,"November 5th, 2010 (Limited) by Fox Searchlight","March 1st, 2011 by Fox Home Entertainment","R for language and some disturbing violent content/bloody images.(Rating bulletin 2133, 8/11/2010)",93 minutes,"Marooned, One Character, One Location, Escape, Breaking the Fourth Wall, Miscellaneous Sports, Non-Chronological, Amputee, 2011 Oscars Best Picture Nominee, Survival Drama",Based on Real Life Events,Live Action,Dramatization,"Big Screen Prods, Down Prods, Dune Entertainment, Everest Entertainment, Darlow Smithson, Decibel Films, Pathe of a Cloud Eight",,"$18,335,230","$41,881,941","$60,217,171","$9,393,620","$2,891,087","$12,284,707"
184,https://www.the-numbers.com/movie/Action-Replayy,[],[],,6.21 (domestic box office/biggest weekend),3.5% (domestic box office/worldwide),,,"$543,369",,Create your own comparison chart…,Drama,India,Hindi,"November 5th, 2010 (Limited) by Viva Entertainment","October 7th, 2014 by Netflix",Not Rated,,,Original Screenplay,Live Action,Contemporary Fiction,,,"$410,262","$11,446,966","$11,857,228",,,
185,https://www.the-numbers.com/movie/Another-Year,"['Oliver Maltman', 'Peter Wight', 'David Bradley', 'Martin Savage', 'Karina Fernandez', 'Michele Austin', 'Phil Davis', 'Imelda Staunton', 'Stuart McQuarrie', 'Jim Broadbent', 'Ruth Sheen', 'Lesley Manville']","[['Mike Leigh', 'Screenwriter'], ['Mike Leigh', 'Director'], ['Georgina Lowe', 'Producer'], ['Gail Egan', 'Executive Producer'], ['Tessa Ross', 'Executive Producer'], ['Dick Pope', 'Cinematographer'], ['Jon Gregory', 'Editor'], ['Simon Beresford', 'Production Designer'], ['Gary Yershon', 'Composer'], ['Jacqueline Durran', 'Costume Designer'], ['Christine Blundell', 'Make-up and Prosthetic Effects Designer'], ['Tim Fraser', 'Sound Mixer'], ['Nina Gold', 'Casting Director']]","$111,869 (3.5% of total gross)",7.23 (domestic box office/biggest weekend),16.0% (domestic box office/worldwide),"$8,000,000 (worldwide box office is 2.5 times production budget)","6 opening theaters/236 max. theaters, 4.5 weeks average run per theater","$4,225,510","November 5th, 2010 (Wide) (United Kingdom)
April 13th, 2012 (Wide) (Lithuania)
August 17th, 2012 (Wide) (Mexico)
September 13th, 2012 (Wide) (Peru)
",vs. Good Will HuntingCreate your own comparison chart…,Drama,United Kingdom,English,"December 29th, 2010 (Limited) by Sony Pictures Classics","June 7th, 2011 by Sony Pictures Home Entertainment","PG-13 for some language.(Rating bulletin 2136, 9/1/2010)",129 minutes,"Autumn Years, Delayed Adulthood, Relationships Gone Wrong",Original Screenplay,Live Action,Contemporary Fiction,"Thin Man Films, Film4, UK Film Council",,"$3,205,706","$16,799,907","$20,005,613",,,
186,https://www.the-numbers.com/movie/Due-Date,"['Michelle Monaghan', 'Jamie Foxx', 'Juliette Lewis', 'Danny McBride', 'RZA', 'Matt Walsh', 'Robert Downey, Jr.', 'Zach Galifianakis']","[['Todd Phillips', 'Producer'], ['Dan Goldberg', 'Producer'], ['Thomas Tull', 'Executive Producer'], ['Susan Downey', 'Executive Producer'], ['Scott Budnick', 'Executive Producer'], ['David Witz', 'Co-Producer'], ['Jeffrey Wetzel', 'Co-Producer'], ['Todd Phillips', 'Director'], ['Alan R. Cohen', 'Screenwriter'], ['Alan Freedland', 'Screenwriter'], ['Adam Sztykiel', 'Screenwriter'], ['Todd Phillips', 'Screenwriter'], ['Alan R. Cohen', 'Story Creator'], ['Alan Freedland', 'Story Creator']]","$32,689,406 (32.5% of total gross)",3.08 (domestic box office/biggest weekend),47.5% (domestic box office/worldwide),"$65,000,000 (worldwide box office is 3.3 times production budget)","3,355 opening theaters/3,365 max. theaters, 5.9 weeks average run per theater","$133,151,340",,vs. Spy!Create your own comparison chart…,Comedy,United States,English,"November 5th, 2010 (Wide) by Warner Bros.","February 22nd, 2011 by Warner Home Video","R for language drug use and sexual content(Rating bulletin 2131, 7/7/2010)",95 minutes,"Road Trip, Buddy Comedy, Directing Yourself",Original Screenplay,Live Action,Contemporary Fiction,"Legendary Pictures, Green Hat Films",,"$100,539,043","$111,200,000","$211,739,043","$28,114,288","$9,991,778","$38,106,066"
